filename	text
0-89-8.wav	หน้าห้างทองแสงเจริญตำบลเจ๊ะเหจังหวัดนราธิวาส
0-91-101.wav	แล้วก็ทีมงานของท่านก็เดินทางไปทางขวา
0-91-271.wav	เข้าสำรวจสภาพภายในถ้ำหลวงขุนน้ำนางนอนจังหวัดเชียงราย
0-91-276.wav	เดินทางไปตรวจเยี่ยมพร้อมให้กำลังใจเจ้าหน้าที่ทุกฝ่าย
0-91-330.wav	ในจังหวัดท่าขี้เหล็กของพม่า
0-91-334.wav	อันนี้ถูกระดมเข้ามาในจังหวัดท่าขี้เหล็กอยู่ตรงข้ามอำเภอแม่สาย
0-91-336.wav	เพราะว่าอะไรคุณผู้ชมดอยนางนอนเนี่ยมันเป็นเทือกเขา
0-91-337.wav	คือเทือกเขานางนอนมันเป็นเทือกเขาที่เรียงตัวกันยาว
0-91-354.wav	ถือว่าเป็นสถานที่สำคัญทางศาสนาของจังหวัดนะคะ
0-95-12.wav	ช่วงด่านความมั่นคงในพื้นที่ตำบลทุ่งโพธิ์อำเภอจุฬาภรณ์จังหวัดนครศรีธรรมราช
7-7093-66.wav	จะเดินทางกลับมาบ้านหลังนี้ที่จังหวัดตรัง
0-95-18.wav	ส่วนที่จังหวัดเลยตำรวจและกู้ภัยเข้าตรวจสอบอุบัติเหตุ
0-98-62.wav	จดที่ไหนจังหวัดไหนนะคะวันที่จดเมื่อไหร่นะคะ
102-102003-15.wav	ซึ่งเป็นของพี่ชายไปให้นายตาต้าซึ่งเป็นชาวกะเหรี่ยง
0-104-10.wav	เจ้าตัวมีโอกาสเดินทางไปทำบุญที่วัดโป่งสะเก็ดจังหวัดชลบุรีค่ะ
0-110-0.wav	โครงการทานใจไทยรัฐที่เดินทางไป
7-7093-85.wav	ถ้าดูในภาพเนี่ยท่านจะเห็นพระรูปหนึ่งที่ท่านเดินทางมาเนี่ยนะฮะ
0-111-18.wav	อยู่ที่อำเภอลำลูกกาจังหวัดปทุมธานี
0-111-25.wav	คือตัวนายมานะน้องชายให้การแบบนี้บอกว่า
7-7093-8.wav	อยู่ในพื้นที่ในสวนสาธารณะพรุชีหมู่2ตำบลโคกหล่ออำเภอเมืองจังหวัดตรัง
0-112-19.wav	ไปดูกันต่อที่ภาคใต้ค่ะที่เห็นอยู่นี่อยู่ที่จังหวัดนครศรีธรรมราชค่ะ
7-7093-9.wav	ตำรวจสภ.เมืองจังหวัดตรังแล้วก็ชุดพิสูจน์หลักฐานแล้วก็แพทย์ด้วยนะครับ
7-7094-15.wav	วันนี้คือออกมาท่องเที่ยวกันหมดแล้วนะคะที่วัดแห่งนี้บรรยากาศก็เลยค่อนข้างคึกคักค่ะ
0-112-4.wav	ก็คือที่จังหวัดนครศรีธรรมราชแล้วก็ที่จังหวัดสกลนครค่ะ
7-7094-16.wav	จำนวนนักท่องเที่ยวที่เดินทางมาเนี่ยไม่รู้กี่พันคนแล้วนะคะ
7-7094-21.wav	ส่วนเรื่องของการเดินทางโดยรถไฟในกรุงโตเกียวเนี่ยนะคะ
0-113-28.wav	แต่นางไม่ยอมรับแค่นั้นเอง
7-7094-24.wav	สามารถเดินทางกันได้ตามปกติแล้วนะคะก็ถือว่าตอนนี้กลับเข้าสู่ภาวะค่อนข้างปกติแล้ว
7-7096-33.wav	เดินทางไปสอบปากคำตำรวจที่อยู่ในงานด้วย
0-117-0.wav	เจ้าของสวนผลไม้ที่จังหวัดกระบี่ค่ะเขาบอกว่าในช่วงเดือนที่ผ่านมาเนี่ย
0-117-6.wav	ตำรวจสภ.ลำทับจังหวัดกระบี่ค่ะไปตรวจสอบนะคะ
7-7096-37.wav	ตอนนี้ก็คือยังมีทั้งหมด29นายอยู่นะสำหรับตำรวจค่ะ
0-118-2.wav	ก็เดินทางกลับมาร่วมซ้อมกับทีมชาติไทยเป็นครั้งแรก
7-7097-0.wav	ว่ามีเกษตรกรท่านหนึ่งเป็นชาวนาในจังหวัดสุโขทัย
7-7099-44.wav	นางก็บอกว่าหนูไม่ได้อยากเล่นละคร
7-7104-0.wav	แต่ถ้าหากใครไม่มีเวลาที่จะเดินทางไปไกล
7-7107-32.wav	ทีมข่าวของเราก็เลยไปสอบถามเพื่อนของนายแม็กซ์
21-21392-49.wav	เป็นชาวจังหวัดสตูลเกิดเมื่อปีพุทธศักราช2485เป็นที่รู้จักกันมาตั้งแต่ในตอนที่เล่นตลกกับ
21-21392-71.wav	โดยตอนนี้เนี่ยทางเขื่อนเจ้าพญาจังหวัดชัยนาทเขาก็อัปเดตข้อมูลในเรื่องของการปล่อยน้ำออกมาแล้วค่ะ
21-21392-74.wav	ระดับน้ำในเขื่อนเจ้าพระยาที่อำเภอสัพยาจังหวัดชัยนาทเนี่ยนะคะตอนนี้น้ำไหลลงสู่เขื่อนเจ้าพระยาผ่านจุดวัดน้ำค่ายจิรประวัติจังหวัดนครสวรรค์เพิ่มขึ้นต่อเนื่องนะคะ
21-21392-93.wav	แล้วก็ไปมอบถุงยังชีพให้กับพี่น้องประชาชนที่จังหวัดพระนครศรีอยุธยา
21-21393-8.wav	ในพื้นที่ตำบลดอนยางจังหวัดเพชรชบุรีนะคะ
21-21394-37.wav	อำเภอเมืองจังหวัดลพบุรีพร้อมกับรถคันนี้เลยค่ะ
21-21395-10.wav	แล้วก็เจ้าหน้าที่ฝ่ายปกครองอำเภอครองหลวงสัก50กว่านายครับ
21-21396-9.wav	ที่จังหวัดตราดสาวพาส่องเลขเด็ด
21-21397-0.wav	ไปดูอุบัติเหตุเกิดขึ้นที่จังหวัดนครนายกนะคะรถไฟชนกับรถกระบะ
21-21397-12.wav	ตำบลท่าเรืออำเภอปากพลีจังหวัดนครนายก
21-21397-6.wav	เป็นชาวจังหวัดศรีสะเกษได้รับบาดเจ็บสาหัสแขนหักลำตัวงอ
21-21397-8.wav	ชื่อว่านายธีรยุทธ์แก้วละมุนอายุ28ปีนะคะ
21-21398-34.wav	ตำรวจบอกว่านางสาวเรคนก่อเหตุเนี่ย
7-7108-23.wav	แล้วก็นำตัวผู้บาดเจ็บก็คือนายคงคา
21-21398-36.wav	เพราะได้ยินนางสาวหนึ่งคนเจ็บไปพูดกับคนอื่น
7-7109-19.wav	ผู้ควบคุมการแข่งขันก็เดินทางไปโรงพยาบาลนะครับเพื่อประสานงานต่าง
21-21398-41.wav	เดี๋ยวเตรียมจะแจ้งข้อหากับนางสาวเรก็คือทำร้ายร่างกาย
21-21398-66.wav	บอกทีมข่าวไทยรัฐทีวีได้นะครับส่วนคนเจ็บนางสาวหนึ่ง
7-7109-30.wav	ใช้เวลาเดินทางไม่ถึง3ชั่วโมงด้วยกันเจ้าตัวไม่มีอาการเพลีย
21-21398-6.wav	นี่เป็นจุดในครัวนะครับเป็นร้านอาหารแห่งหนึ่งในปั๊มน้ำมันที่จังหวัดพิษณุโลก
7-7109-31.wav	อาการเหนื่อยล้าให้เห็นนะครับซึ่งสาเหตุที่ต้องกลับบ้านที่จังหวัดกาฬสินธุ์นะครับ
21-21405-16.wav	ผู้ตายก็คือนางลำไพรโควัฒนกุลอายุ41ปี
7-7109-34.wav	แต่ว่ารายงานล่าสุดก็ออกมาบอกแล้วว่าจะกลับไปบำเพ็ญกุศลที่บ้านเกิดจังหวัดสุโขทัยนะครับ
21-21408-17.wav	รองผู้บัญชาการตำรวจสอบสวนกลางบอกว่าคือเนื่องจากมีการแพร่ระบาดของกาแฟปลอมในหลายจังหวัดนะคะ
21-21408-6.wav	อำเภอลาดหลุมแก้วจังหวัดปทุมธานี
7-7111-7.wav	พาไปดูชาวบ้านคำน้ำเกลี้ยงตำบลทุ่งแต๊อำเภอเมืองจังหวัดยโสธร
21-21409-18.wav	เขาก็เดินทางมาเปิดใจกับบันเทิงไทยรัฐนะเกี่ยวกับเรื่องราวความรักของทั้งคู่ด้วย
7-7114-18.wav	โดยความสำเร็จของนายอีลอนมัสก์
0-122-1.wav	ฝาท่อระบายน้ำบนถนนในจังหวัดชลบุรีเนี่ย
21-21410-25.wav	นายชายนายชายในนามสมมุตินะ
21-21410-33.wav	โดยนายสุริยาหางคิ้วแตก
21-21410-19.wav	ก็สอบถามนายสุริยาอยู่บำรุงอายุ25ปี
21-21410-36.wav	บอกว่านายชายคนขับรถกระบะส่งของ
0-122-4.wav	อยู่เหมือนกันนะซึ่งเอ่อทางนายกอบต.หนองรีเขาบอกเลยว่า
21-21410-50.wav	นายสุริยาบอกว่าหากเป็นอยู่แบบนี้คุณ
21-21411-105.wav	ก็เลยคิดว่าเป็นเรื่องนี้นายบอยอ้างแบบนี้นะคะ
21-21411-10.wav	นายธวัชชัยงอกคำอายุ26ปีหรือนายบอย
21-21411-11.wav	2คนนี้เป็นผู้ต้องหาก่อเหตุข่มขืนเด็กหญิงอายุ14ปีในจังหวัดชัยภูมิ
21-21411-131.wav	ทีมข่าวของเราก็เลยไปที่บ้านพักเด็กและครอบครัวจังหวัดชัยภูมินะคะ
0-122-9.wav	นี่คือถนนหลังวัดช่องมะเฟืองนะคะที่ตำบลหนองรีอำเภอเมืองจังหวัดชลบุรี
7-7118-13.wav	อำเภอนาดีได้ประสานหน่วยงานปพ.จังหวัดปราจีนบุรี
21-21411-132.wav	ไปคุยกับนางสาวสุชีวาบุญกอง
0-124-41.wav	ตำรวจนายนั้นก็นำเงินส่วนตัวใส่คืนคลังทันที
21-21411-133.wav	เจ้าหน้าที่บ้านพักเด็กและครอบครัวจังหวัดชัยภูมิ
7-7118-18.wav	ที่ชุมชนตลาดเก่าเทศบาลกบินทร์บุรีจังหวัดปราจีนบุรี
7-7118-25.wav	แล้วก็น้ำในแควพระปรงไหลมาจากจังหวัดสระแก้ว
0-126-204.wav	เขาจะไปขอสะใภ้ที่จังหวัดสุรินทร์
7-7118-27.wav	ไปที่จังหวัดสระแก้วกันหน่อยนะคะป้องกันและบรรเทาสาธารณภัยจังหวัด
7-7118-32.wav	จังหวัดชลบุรีนานหลายชั่วโมงนะครับชลบุรีพอน้ำท่วมอ่า
21-21411-7.wav	เหตุการณ์นี้เกิดขึ้นที่จังหวัดชัยภูมิแต่พอทั้งสองคนไปมอบตัวเขาบอกว่าเขาไม่ได้ข่มขืน
7-7119-106.wav	นี่คือเขาเล่าเป็นฉากเลยนายโด่งคนนี้
21-21419-23.wav	คนตายน่าจะชื่อนางสาวกุ๊กกิ๊กอายุ22ปี
21-21419-28.wav	พร้อมกับล็อกกุญแจไว้ทำให้นางสาวกุ๊กกิ๊กขาดอากาศหายใจ
21-21419-31.wav	สิ่งที่นายเฉลิมชนให้การกับตำรวจขัดแย้งกับนายไอซ์โดยบอกว่า
21-21419-42.wav	จากคดีนี้นายไอซ์ต้องติดคุก
21-21419-50.wav	แต่หลังจากพ้นโทษนายเฉลิมชัย
0-132-53.wav	กลับไปทำบุญที่วัดในจังหวัดศรีสะเกษมุ่งหน้ากลับพิษณุโลกค่ะ
21-21419-73.wav	ก็คือนางสาวกุ๊กกิ๊ก
21-21419-8.wav	ชายคนนี้คือนายอภิชัยหรือไอซ์องค์วิสิต
7-7119-83.wav	โอ้ยมีแต่คนแก่ไม่สะดวกหรอกเดินทางมาก็ไม่สะดวก
0-132-8.wav	เหตุการณ์นี้เกิดขึ้นสี่แยกบางพลูถนนรัตนาธิเบศร์อำเภอบางบัวทองจังหวัดนนทบุรีค่ะ
7-7120-7.wav	ซึ่งเป็นงานประจำปีของชาวอำเภอศรีเทพจังหวัดเพชรบูรณ์นะครับ
21-21420-15.wav	ภรรยาของคนเจ็บนะฮะคือนางดอกแก้วนะครับบอกถึงปมเหตุว่าทั้งสองคนคือบุญชมสามีของเธอกับเกษมหลานของเธอ
7-7121-23.wav	ในภาคเหนือคลี่คลายแล้วยังเหลือจังหวัดพะเยาและจังหวัดน่าน
7-7121-24.wav	ยังมีปัญหาอยู่ซึ่งก็ต้องรอให้น้ำลงสู่จังหวัดสุโขทัย
21-21420-28.wav	หลานสาวของคนเจ็บนะฮะหลานสาวของนายบุญชมเนี่ยบอกว่าไอ้ที่ดินปัญหาเนี่ย
0-133-85.wav	เป็นนายหนังตะลุงไงเป็นมโนรา
7-7121-25.wav	ส่วนจังหวัดพิษณุโลกก็ได้สั่งการให้กรมป้องกันและบรรเทาสาธารณภัย
21-21420-30.wav	คือก่อนหน้านี้รุนแรงถึงขั้นที่นายเกษมผู้ก่อเหตุเนี่ย
21-21420-31.wav	เคยเอามีดเนี่ยฟันนายบุญชมจนนิ้วเกือบขาดมาแล้ว
21-21420-35.wav	เพราะกลัวว่านายเกษมจะย้อนมาก่อเหตุฆ่าคนในครอบครัวคนเจ็บ
21-21420-37.wav	อาการของนายบุญชมตอนนี้หมอบอกว่าพ้นขีดอันตรายแล้ว
21-21420-5.wav	มีจักรยานยนต์ของนายบุญชมเนี่ยล้มคว่ำอยู่ด้วยนะครับก็ถูกนำตัวส่งโรงพยาบาล
0-134-4.wav	ชาวบ้านอยู่ที่ตำบลกระชอนอำเภอพิมายจังหวัดนครราชสีมา
21-21420-6.wav	จากการสอบสวนทราบว่าก่อนเกิดเหตุนายบุญชมคนเจ็บขี่จักรยานยนต์จะไปเก็บเงินนะฮะ
21-21420-7.wav	เป็นเงินออมวันละบาทที่ชุมชนบัวขาวระหว่างทางเนี่ยไปเจอกับนายเกษมภารีนนท์
7-7122-25.wav	จังหวัดได้ขึ้นอัตราค่าจ้างขั้นต่ำมากที่สุด
21-21421-25.wav	เช้าที่ผ่านมามือยิงครับคือนายตั้มหรือว่านายวิเศษ
21-21422-17.wav	ซึ่งก็เรียกตัวนายสามารถเจ้าของร้านที่เกิดเหตุมาสอบปากคำอีกรอบนึง
7-7122-30.wav	และอีก2จังหวัดที่น่าสนใจก็คือชลบุรีและระยอง
0-137-29.wav	ซึ่งเป็นลิเกชื่อดังของจังหวัดพิจิตรเปิดเผยว่า
0-137-3.wav	การแสดงศิลปะพื้นบ้านลิเกของชาวอำเภอตะพานหินจังหวัดพิจิตร
7-7122-31.wav	ทำไม2จังหวัดนี้ถึงได้เพิ่มค่าแรงขั้นต่ำสูงที่สุดรู้ไหม
21-21424-11.wav	ผู้บังคับการตำรวจภูธรจังหวัดอุดรธานีนำรถจักรยานยนต์คันนี้
21-21424-23.wav	แล้วก็เอาเอกสารใต้เบาะอ้าวไปพบชื่อของนายนคร
0-137-44.wav	ไม่เพียงเท่านี้เยาวชนในจังหวัดพิจิตร
7-7122-43.wav	จังหวัดที่ได้เพิ่มเงินเป็น325บาท
21-21424-31.wav	อยากจะขอบคุณตำรวจทุกนายที่ใส่ใจดูแลและนำรถมาคืนให้ถึงบ้าน
7-7122-49.wav	จังหวัดที่ได้เพิ่มเป็น320บาท
0-139-44.wav	ช่วงเช้าตำรวจเดี๋ยวจะเดินทางไปเจอกับนายจ้าง
7-7122-54.wav	ส่วนจังหวัดที่ได้ขึ้นเป็น318บาทมี7จังหวัด
0-141-266.wav	ทางจังหวัดทางภาคเหนือจะเกิดเหตุฝนตกหนักในจังหวัดน่านและจังหวัดพะเยา
0-141-322.wav	ในหลายจังหวัดทางภาคเหนือแล้วก็เกิดเหตุฝนตกหนัก
7-7122-58.wav	ก็มี21จังหวัดไล่เลียงแบบนี้
0-141-323.wav	ในจังหวัดน่านและพะเยาอย่างนี้นะ
21-21425-125.wav	ช่วงนี้นางยุ่งอยู่นางถ่ายละครอยู่
7-7122-57.wav	ส่วนจังหวัดที่ได้ขึ้นเป็น315บาท
21-21425-246.wav	เขาก็เดินทางไปแจ้งความว่ากาโตะไปพูดแบบนี้ต่าง
21-21425-470.wav	หน้าวัดแห่งหนึ่งที่จังหวัดพิษณุโลกครับ
21-21425-688.wav	พร้อมกับนั่งจับกลุ่มคุยกันนะครับถึงการตายของนายวิชาณว่า
21-21425-689.wav	หลังจากนายวิชาญผูกคอตายไปแล้วเพียงข้ามคืนเดียวเนี่ย
7-7122-65.wav	จังหวัดที่ขึ้น310บาทมีอีก22จังหวัดฮะ
21-21426-7.wav	นายนิพนธ์บุญยามณีนายกองค์การบริหารส่วนจังหวัดสงขลาค่ะ
0-141-623.wav	มีข่าวมาว่าหลายคนจากหลายจังหวัดทยอยไปที่นี่
7-7122-66.wav	2จังหวัดที่ได้ค่าแรงขั้นต่ำนะคะ
21-21429-16.wav	ผมยืนยันนะครับวันนี้ก็เริ่มดำเนินการเปิดไปแล้วที่ภูเก็ตแซนบล็อกแล้วก็จะมีการขยายไปยังจังหวัดต่างโดยรอบ
21-21429-289.wav	ผมพูดไปแล้วนะครับ3ประเทศแม้ว่ารายได้ของท่องเที่ยวจากของประเทศไทยในปี63
7-7122-74.wav	ขณะที่จังหวัดที่ได้ค่าแรงที่ต่ำลงมาอีกสักนิดนึง2บาทนะคะ
21-21431-26.wav	ยืนยันว่าจะอยู่เคียงข้างนายพิธาเพื่อรักษาประชาธิปไตยที่มาจากประชาชน
21-21431-34.wav	แต่เมื่อได้ฟังเหตุผลของนายพิธาแล้วก็เห็นด้วยในการแก้ไข
21-21431-36.wav	มาเป็นเงื่อนไขในการโหวตไม่เห็นชอบให้นายพิธาเป็นนายก
0-141-882.wav	แล้วนางก็เล่าให้ฟังว่านางก็ขึ้นไปบนศาลา
7-7132-18.wav	เขาจัดไว้หลายจุดนะครับเพราะว่าทางจังหวัดเขาจัดไว้
21-21434-120.wav	อำเภอเดียวครับในจังหวัดขอนแก่นหน้าถัดไปครับ
0-142-16.wav	จังหวัดนครปฐมตั้งด่านตรวจค้น
7-7132-19.wav	ทั้งที่สนามกีฬากลางจังหวัดนะครับทั้งที่โรงงานต่างๆ
21-21437-0.wav	เรามาดูเหตุสลดที่เกิดขึ้นที่จังหวัดสุรินทร์กันก่อน
21-21437-35.wav	ขณะที่นางสาวจีราพรโสรจันทร์อายุ20ปีภรรยาผู้ตาย
21-21437-37.wav	หลังจากที่เดินทางมาจากบ้านพ่อของตัวเองเพื่อมาดูลูกแต่เช้า
