filename	text
0-283-0.wav	คุณผู้ชมค่ะเมื่อวานนี้เป็นวันพระมีคุณผู้ชมทางบ้านส่งมาอวยพรเราด้วยบอกว่าไปทำบุญมาแล้วก็เอาบุญมาฝากนะคะแต่ว่าเดี๋ยวเราพาคุณผู้ชมไปที่จังหวัดขอนแก่นค่ะ
21-21903-134.wav	ถ้าเกิดท่านนายกลาออกจะไม่ตีกันเนี่ย
21-21903-33.wav	ส่วนที่จังหวัดลพบุรีเป็นยังไงครับน้องปุ้ยฮะ
21-21903-40.wav	ปัญหาการคมนาคมในจังหวัดลพบุรี
7-7481-10.wav	เหตุการณ์นี้เกิดขึ้นที่บ้านหนองไฮใต้ในอำเภอหนองบัวแดงจังหวัดชัยภูมิค่ะ
21-21903-60.wav	ครับส่วนนักเรียนในอำเภอพระประแดงจังหวัดสมุทรปราการนะครับ
21-21903-81.wav	มีเจ้าหน้าที่หลายร้อยนายนะคะดูแลความปลอดภัย
21-21905-0.wav	ในวันนี้นะคะก็มีอีกหนึ่งขวัญกำลังใจที่เดินทางมาทำพิธีอธิษฐานจิตให้ทั้ง13ชีวิตอยู่รอดปลอดภัยด้วย
0-285-10.wav	ภายในวัดท้ายเกาะตำบลไตรตรึงษ์จังหวัดกำแพงเพชร
21-21905-15.wav	วันนี้เองครับก็เลยมีการนิมนต์พระครูบาบุญชุ่มนะครับที่เป็นพระคู่บ้านคู่เมืองของชาวจังหวัดเชียงรายครับ
0-285-5.wav	ชาวบ้านที่รู้ข่าวก็เลยเดินทางไปที่วัดแห่งนี้
7-7489-1023.wav	หรือที่ชาวบ้านเรียกง่ายว่าวัดป่านาฝายจังหวัดเลย
7-7489-1030.wav	หลังจากนั้นก็กลับมาทำบุญต่อที่วัดป่าสว่างธรรมจังหวัดอุดร
7-7489-1075.wav	เป็นผู้ป่วยติดเตียงเพิ่งรู้นางก็ลุกขึ้นไปวิ่ง
21-21905-5.wav	จำนวน13ชีวิตที่ติดอยู่ในถ้ำหลวงขุนน้ำนางนอนนะครับต้องบอกว่า
7-7489-1086.wav	คุณพ่อใช้ชีวิตอย่างมีความสุขเดินทางไปต่างประเทศแทบจะทุกเดือน
21-21909-16.wav	วันนี้ยังทยอยเดินทางมารับใบรับรอง
21-21909-22.wav	ทยอยเดินทางมาตั้งแต่ช่วงเช้า
7-7489-204.wav	อยู่ที่ตำบลพระพุทธบาทอำเภอพระพุทธบาทจังหวัดสระบุรีเนี่ย
21-21910-25.wav	อยู่ในพื้นที่อำเภอบ้านไร่จังหวัดอุทัยธานี
7-7489-241.wav	จะคุมตัว2ผู้ต้องหาเนี่ยไปรอขออำนาจศาลจากจังหวัดสระบุรีก่อน
21-21913-26.wav	ท้องที่สภ.บางพลีจังหวัดสมุทรปราการค่ะ
7-7489-283.wav	ที่เอ่อนายคนนี้เขาไปพบอยู่นะคะก็
7-7489-284.wav	เขาบอกว่าที่หมู่บ้านนี้นะคะอยู่ที่จังหวัดชัยภูมินะคะ
7-7489-287.wav	ชาวจังหวัดนครนายกจมน้ำเสียชีวิต
7-7489-660.wav	ที่จังหวัดเชียงใหม่ก็ที่อุทยานดาราศาสตร์สิรินธรอำเภอแม่ริม
7-7490-30.wav	ไปทานกันได้ร้านชื่อว่าร้านไอวานะกว๊านพะเยาอยู่ที่ตำบลเวียงอำเภอเมืองจังหวัดพะเยา
7-7490-8.wav	ตั้งอยู่ที่ถนนชายกว้านตำบลเวียงอำเภอเมืองจังหวัดพะเยา
21-21921-59.wav	มหาวิทยาลัยแม่โจ้จังหวัดเชียงใหม่กว่าพันคนนะคะ
21-21925-1.wav	หายไปนะคะจากสถานีเพาะเลี้ยงนกน้ำบางพระจังหวัดชลบุรี
7-7492-22.wav	ในพื้นที่หมู่6ตำบลนาท่อมอำเภอเมืองจังหวัดพัทลุง
21-21926-10.wav	แต่ว่าจนถึงขนาดนี้ยังไม่มีการเดินทางกลับไปยังบ้านพักในประเทศสเปน
7-7492-26.wav	นักธุรกิจรับเหมาก่อสร้างรายใหญ่ในจังหวัดพัทลุง
7-7492-42.wav	เดินทางไปติดตามความคืบหน้าของคดีด้วยตัวเองเลยนะคะ
21-21926-11.wav	อีกทั้งฐานข้อมูลของสำนักงานตรวจคนเข้าเมืองของไทยก็ไม่พบว่านักท่องเที่ยวรายนี้เดินทางออกจากประเทศไทยไปแล้วเช่นกันครับ
21-21926-72.wav	ได้รับการตอบกลับจากญาติหรือยังคะว่าจะเดินทางมาให้ตรวจสอบดีเอ็นเอได้เมื่อไหร่
21-21927-233.wav	เราต้องพัฒนาเป็นภาคเป็นกลุ่มจังหวัดและเป็นจังหวัดนะครับ
7-7497-10.wav	กู้ชีพจังหวัดกาญจนบุรีช่วยหญิงสาวชาวเมียนมาอายุ40ปี
21-21928-1.wav	ต่างนิยมเดินทางไปท่องเที่ยวนะครับ
7-7498-8.wav	ก่อนจะเดินทางกลับด้วยสีหน้าเรียบเฉย
7-7499-12.wav	อยู่ที่ตำบลวังพงศ์อำเภอปราณบุรีจังหวัดประจวบคีรีขันธ์14ไร่นะครับ
21-21930-2.wav	สุดสัปดาห์นี้ใครวางแผนจะไปท่องเที่ยวต้องบอกคุณผู้ชมไว้ให้เตรียมตัวเตรียมใจให้ดี
21-21930-8.wav	รวมไปถึงงดการท่องเที่ยวทั้งฝั่งอ่าวไทยและอันดามันไปก่อนนะคะแต่ว่าคุณผู้ชมท่านใดค่ะที่จะเดินทางไปภาคเหนือภาคอีสานก็ต้องตรวจสอบสภาพอากาศกันอย่างละเอียดกันอีกครั้งหนึ่ง
7-7499-43.wav	ส่วนการขายที่ดินที่อำเภอปราณบุรีจังหวัดประจวบคีรีขันธ์นะครับ
21-21931-35.wav	ครับและทั้งคู่ก็เดินทางกลับทีเนี้ยพนักงานสอบสวน
21-21931-44.wav	ทีนี้เราก็ตรวจสอบดูนะคะว่าตกลงแล้วเป็นลูกของนายตำรวจระดับสูงจริงหรือเปล่า
7-7499-4.wav	สื่อก็พุ่งเป้าแล้วให้ความสนใจที่บัญชีทรัพย์สินของนายพิธาลิ้มเจริญรัตน์นะครับ
21-21931-4.wav	ผู้ชายคนนี้อายุ27แล้วก็บอกน้องว่าเป็นลูกชายนายตำรวจระดับสูงเลย
21-21931-55.wav	สถานที่เกิดเหตุอยู่ในพื้นที่จังหวัดนนทบุรีเป็นโรงแรมม่านรูดในอำเภอบางกรวย
7-7502-126.wav	คุณผู้ชมครับเดินทางมาถึงตรงจุดนี้ครับ
7-7502-171.wav	เดินทางไปที่จังหวัดนครสวรรค์ครับขึ้นรถไป
21-21933-41.wav	ในอำเภอเวียงป่าเป้าจังหวัดเชียงราย
7-7502-173.wav	และไปสังเกตการใช้ชีวิตของน้องเข้าสู่จังหวัดนครสวรรค์
21-21933-55.wav	แล้วก็จังหวัดใกล้เคียงแม้จะตัวเล็กกว่า
7-7502-24.wav	ที่แม่กลองจังหวัดสมุทรสงครามครับ
21-21933-6.wav	ที่จังหวัดเชียงใหม่เขาเป็นผู้หญิงเหมือนดิฉันเลย
7-7503-5.wav	หมู่3ตำบลบึงอำเภอศรีราชาจังหวัดชลบุรีนะครับ
7-7504-8.wav	ที่บ้านเมืองทองตำบลเมืองทองจังหวัดร้อยเอ็ดนะครับ
7-7507-10.wav	เป็นชาวบ้านคำขามอำเภอหนองกรุงศรีจังหวัดกาฬสินธุ์
7-7507-13.wav	ผู้บังคับการตำรวจภูธรจังหวัดกาฬสินธุ์และเจ้าหน้าที่สำนักงานยุติธรรมประจำจังหวัด
7-7507-33.wav	จากสำนักงานยุติธรรมจังหวัดกาฬสินธุ์นะคะ
21-21902-43.wav	ส่วนคำร้องการถือหุ้นสื่อของนายพิธาลิ้มเจริณรัตน์
21-21937-64.wav	เจ้าหน้าที่บอกว่าเดี๋ยวต้องประสานไปยังจังหวัดปทุมธานีนะฮะ
21-21909-71.wav	นายปียบุตรเลขาธิการพรรคอนาคตใหม่ก็เดินทางเข้ายื่นคำร้อง
7-7507-30.wav	นางสาวไพรินรัตนโกสินทร์อายุ35ปีบอกว่า
7-7516-40.wav	ในการปฏิบัติหน้าที่รวมๆแล้ว16นายค่ะ
21-21942-10.wav	และถือว่าเป็นเสาหลักของจังหวัด
21-21942-8.wav	ได้เข้ามาพูดคุยและร่วมแสดงความเสียใจต่อการจากไปของนายบรรหาร
21-21942-9.wav	ซึ่งเป็นที่เคารพรักของประชาชนจังหวัดสุพรรณบุรี
21-21944-20.wav	ก็จะมีลูกค้าบางส่วนที่ไหว้ในช่วงบ่ายเดินทางออกมาจับจ่ายใช้สอยกันค่ะ
21-21944-6.wav	เพื่อเป็นการอำนวยความสะดวกให้กับประชาชนที่จะเดินทางมากราบไหว้ขอพรในช่วงเช้านี้ค่ะ
21-21947-213.wav	ส่วนนายเฉลิมชัยเฟื่องคอนก็เสนอนะคะว่า
21-21948-3.wav	พาคุณผู้ชมไปที่จังหวัดประจวบคีรีขันธ์นะคะ
21-21950-10.wav	รองลงมา353บาทมี6จังหวัด
21-21950-9.wav	จะมี3จังหวัดนะคะคือชลบุรีระยองและภูเก็ตค่ะ
21-21951-58.wav	ด้านผู้เสียหายได้เดินทางไปยังศาลจังหวัดตลิ่งชัน
21-21952-19.wav	หลังจากที่เสร็จสิ้นพิธีได้เห็นนางรำกว่า20คนผ่านไปแล้วเนาะ
21-21952-32.wav	อารมณ์ประมาณว่าแจกโชคไงเผื่อไปลุ้นโชคกันต่อสำหรับนางรำ
21-21953-40.wav	นางรัตนาพรสุภาทิพย์หรือเจ๊บ้าบิน
21-21953-71.wav	กลุ่มตำรวจที่ทำคดีที่จังหวัดกาญจนบุรี
21-21954-17.wav	ฝ่ายปกครองจังหวัดมหาสารคามและทหาร
21-21954-1.wav	และคิดดอกเบี้ยโหดบ้างทางด้านของฝ่ายปกครองจังหวัดมหาสารคาม
21-21954-36.wav	บอกว่าตัวเองเป็นชาวจังหวัดชัยนาทนำเงินจำนวนหลายล้านบาทเนี่ยมาปล่อยกู้ให้ชาวบ้านในภาคอีสาน
21-21956-0.wav	พนมทวนจังหวัดกาญจนบุรีคุณผู้ชม
21-21959-13.wav	ใครที่อยากจะทำบุญสามารถร่วมบริจาคกันได้ที่ธรรมสถานแม่ชีหลวงดาจังหวัดปทุมธานีนะคะ
21-21959-4.wav	ธรรมสถานแม่ชีหลวงดาจังหวัดปทุมธานี
21-21959-6.wav	พลังความศรัทธาจากเหล่าลูกศิษย์ค่ะเดินทางมาร่วมงานกัน
21-21960-8.wav	เขาประเดิมเล่นไปแล้วเมื่อคืนก่อนนะคะที่จังหวัดสระบุรีค่ะ
21-21964-66.wav	โดยพบว่าตั้งแต่บริเวณจังหวัดสุราษฎร์ธานี
21-21966-104.wav	เธอก็ใช้ชีวิตและมีความลำบากในเรื่องการเดินทางอยู่แล้ว
21-21966-41.wav	ล่าสุดค่ะผู้สื่อข่าวเราเดินทางไปที่บ้านของผู้หญิงคนนี้นะคะ
21-21967-103.wav	เขาจะเดินทางจากกรุงเทพไปที่เกาะสมุย
21-21967-106.wav	นายมงคลทองโบราณพร้อมด้วยภรรยาและลูกอีก2คนนี้นะคะ
21-21967-110.wav	ก็คือเดินทางเลยไม่ได้มีการพักในวันนั้น
21-21967-124.wav	โอนเงินมาให้เพื่อที่จะเดินทางต่อจนถึงช่วงเช้า
21-21967-125.wav	ก็คือไปถึงที่เกาะสมุยที่จังหวัดสุราษฎร์ธานี
21-21967-14.wav	เขาเล่าให้ฟังบอกว่าตัวเองเดินทาง7มกราคมที่ผ่านมา
21-21967-73.wav	จังหวัดประจวบอำเภอชะอำจังหวัดเพชรชบุรี
21-21973-1.wav	อย่างโตโยต้าเองครับไปปลูกป่านิเวศให้กับพื้นที่จังหวัดน่านโดยใช้เทคนิคพิเศษนะครับ
21-21973-5.wav	และอาสาสมัครในพื้นที่จังหวัดน่าน
21-21974-0.wav	โอ้โหภาพนี้เหตุการณ์นี้อาจจะเป็นอีกครั้งหนึ่งที่เป็นอุทาหรณ์นะคะสำหรับการเดินทางบนท้องถนนเนี่ยค่ะ
21-21975-2.wav	วันนี้ก็เดินทางไปพร้อมกับทนายความ
21-21979-20.wav	นะฮะเป็นอาสาสมัครหนึ่งเดียวที่เดินทางมาจากจังหวัดประจวบคีรีขันธ์นะครับ
21-21979-24.wav	ลุงก็จะเอามาเลี้ยงแต่วันนี้คุณลุงเขาเดินทางมาที่นี่ตั้งใจเลยครับ
21-21979-25.wav	ที่มาที่ถ้ำหลวงในนามของจิตอาสาจังหวัดประจวบคีรีขันธ์นะครับ
21-21979-45.wav	แต่ผมก็ไม่สนใจนะครับจะได้ไม่ได้จะหมดงบเท่าไรการเดินทางผมนะ
21-21979-49.wav	เขาก็บอกว่าเขาเนี่ยเป็นชาวจังหวัดนครศรีธรรมราชตั้งใจมานวดให้ฟรีเลย
21-21980-28.wav	ผู้กำกับการสถานีตำรวจภูธรจังหวัดพระนครศรีอยุธยา
21-21982-16.wav	พร้อมด้วยนางสาวสมศรีสายสมคุณบุตรสาวคนโต
21-21984-17.wav	ตำรวจชุดสืบสวนเชิญตัวนางสาววิไลพร
21-21984-186.wav	ผู้สื่อข่าวก็ถามเพื่อนบ้านชื่อว่านางสาวติ๊กนะคะ
21-21984-74.wav	พัฒนาสังคมและความมั่นคงของมนุษย์จังหวัดชลบุรี
21-21990-5.wav	ก็มีการโพสต์เรื่องราวของผู้หญิงคนหนึ่งก็เดินทางไปเที่ยวสเปนช่วงปีใหม่
21-21991-0.wav	จังหวัดเลยมีคนไปพบศพผู้หญิงคนหนึ่งเป็นผู้ช่วยผู้ใหญ่บ้าน
21-21991-12.wav	นายบุญธรรมวัย67ปีพ่อผู้ตายซึ่งอยู่ในอาการโศกเศร้าเล่าว่า
21-21991-16.wav	พบผู้ต้องสงสัยคือนายขจรวัย40ปีที่บ้านอยู่ห่างกันไม่ถึงร้อยเมตรโดยเมื่อ2เดือนก่อน
21-21991-17.wav	นายขจรเคยเข้ามาลักทรัพย์ในบ้านหลังนี้ได้เงินไป8500บาทแต่มีคนมาเจรจาเจ้าของบ้านเห็นเป็นคนบ้านเดียวกันจึงไม่เอาเรื่อง
21-21991-40.wav	ตำรวจยังบี้สอบปากคำนายขจร
21-21991-44.wav	ในชั้นนี้นายขจรยังให้การปฏิเสธตลอดข้อหา
21-21991-48.wav	ไม่ว่าใครจะเป็นคนร้ายนายขจรจะเกี่ยวข้องหรือไม่
21-21991-50.wav	แต่ในชั้นนี้ตำรวจแจ้งข้อหานายขจร
21-21991-7.wav	เช้าตรู่วันที่23สิงหาคมตำรวจสภ.ภูกระดึงรุดไปชนะสูตรพลิกศพนางสาวดัชนี
21-21993-107.wav	ก็ต้องมีการบวงสรวงนางตะเคียน
21-21993-108.wav	เพราะว่าเชื่อว่านางศักดิ์ตะเคียนสิงสถิตอยู่แล้วก็เป็นต้นไม้เก่าแก่
21-21993-110.wav	ถ้าเป็นเรือนำมาทำเป็นเรือก็จะเรียกนางตะเคียนนี้ว่าแม่ย่านาง
21-21993-111.wav	ถ้ามาทำเป็นบ้านก็จะเรียกนางตะเคียนว่าผีบ้านผีเรือน
21-21993-112.wav	อันนี้เป็นความเชื่อแต่โบร่ำโบราณเกี่ยวกับเรื่องของนางตะเคียน
21-21993-1.wav	ว่าแต่ละจังหวัดเขาไปขอที่ไหนมีเลขอะไร
21-21993-98.wav	ความเชื่อของนางตะเคียนมีความเชื่อมาแต่โบร่ำโบราณคุณ
21-21994-13.wav	โรงเรียนสามัคคีวิทยาคารเทศบาลเมืองน่านอำเภอเมืองน่านจังหวัดน่าน
21-21994-2.wav	คุณผู้ชมจำได้ไหมคะก่อนหน้านี้โรงเรียนแห่งหนึ่งที่จังหวัดน่าน
102-102024-8.wav	ยิงซะเลยท่านผู้ชมดูนะฮะอันนี้อยู่ในจังหวัดพัทลุงนะครับ
7-7508-7.wav	ฝ่ายปกครองจังหวัดมหาสารคาม
0-289-0.wav	ฉุกเฉินของโรงพยาบาลที่จังหวัดสกลนครครับคุณผู้ชมครับ
0-291-27.wav	รวบตัวได้3คนคนแรกชื่อว่านายจ๊าบ
0-292-2.wav	ลักทรัพย์บ้านถึง3หลังในพื้นที่2อำเภอของจังหวัดเชียงราย
0-295-47.wav	ตำบลนาเกลืออำเภอบางละมุงจังหวัดชลบุรี
0-300-22.wav	ก็ต้องตรวจสอบสภาพอากาศดีๆสำหรับใครที่จะไปท่องเที่ยว
0-300-32.wav	ใครที่จะใช้ชีวิตเดินทางไปต่างจังหวัดหรือว่าทำกิจกรรมกลางแจ้ง
21-21994-22.wav	คือนายสุรพลเธียรสูตรนายกเทศมนตรีเทศบาลเมืองน่านเลยนะคะ
0-305-1.wav	จังหวัดนครราชสีมาผู้หญิงคนหนึ่งเธอไปทำบุญที่วัดบ่อย
21-21993-87.wav	นายน้อยคนขับรถแบ็กโฮขุดลอกคลองบอกว่า
0-310-25.wav	ใกล้ศพกับผู้ตายนั่นแหละนอกจากนี้มีนายเอ
0-312-16.wav	นายเอกเนี่ยมาทำร้ายร่างกายเธอพร้อมกับขู่ฆ่าแล้วแอบกระทำกับลูกสาวคนโตเรื่อยมา
21-21993-67.wav	รวมถึงมีเสื้อผ้าชุดนางตะเคียนสวยๆแบบนี้ด้วย
7-7510-51.wav	หลังจากที่ตำรวจรับทราบนะตำรวจก็มาเป็น10นายเลยมากับชาวบ้าน
0-312-8.wav	อยู่กินกับนายเอกมานานกว่า10กว่าปีแล้ว
21-21993-13.wav	นายคำลือเขตสนานผู้ใหญ่บ้านคำบอนเวียงชัยบอกเลยค่ะว่า
