filename	text
7-7191-3.wav	แต่ว่าแพทย์ช่วยชีวิตรอดไว้ได้อย่างหวุดหวิดครับเจ้าหน้าที่ก็เข้าชันสูตรพลิกศพนางสาวสิริวัญชัยสงฆ์(สิริวัญชัยสงฆ์,สิริวรรณชัยสงฆ์)อายุ21(ยี่สิบเอ็ด,21)ปี
7-7191-5.wav	ถัดไปข้างห้องพบร่างของนายอดุลเรียวชัยภูมิ(เรียวชัยภูมิ,เรืองชัยภูมิ)อายุ27(ยี่สิบเจ็ด,27)ปีสามีถูกของมีคมปาดที่บริเวณลำคอเลือดไหลนองเต็มพื้นบ้านร้องครวญครางยังมีชีวิตอยู่นะครับ
7-7191-7.wav	โดยเหตุสลดนั้นเกิดขึ้นที่บ้านหมู่9(เก้า,9)ตำบลถ้ำบัวแดงอำเภอหนองบัวแดงที่จังหวัดชัยภูมินะครับ
7-7191-9.wav	และเมื่อวานนี้ก่อนเกิดเหตุฝ่ายชายก็ดื่มเหล้ามาแล้วก็เกิดปากเสียงกับภรรยาอีกครั้งก่อนที่เพื่อนบ้านก็ได้ยินเสียงปืนดังขึ้น1(หนึ่ง,1)นัดจึงรีบวิ่งมาดูนะครับก็พบร่างของนางสาวสิริวัล(สิริวัล,สิริวรรณ)นอนจมกองเลือดเสียชีวิตส่วนนายอดุล<MARK>บาดเจ็บเพื่อนบ้านก็เลยรีบแจ้งเจ้าหน้าที่ให้เข้ามาช่วยเหลือครับ
7-7192-0.wav	เรื่องเกี่ยวกับต้นโพธิ์ออาถรรพ์ที่จังหวัดอ่างทองคุณผู้ชมค่ะ
7-7192-117.wav	แต่ก่อนเดินทางกลับหมอปลา<MARK>ก็เข้าไปบอกเรื่องราวนี้ทั้งหมด
7-7192-51.wav	แล้วช่วงหลังนะคะนายสุนทร<MARK>ยังเห็นคล้ายกับดวงไฟกลม
7-7192-8.wav	แล้วหลังจากนั้นนะคะนายสมหวังช่างจัด<MARK>อายุ65(หกสิบห้า,65)ปีเจ้าของบ้าน
7-7192-92.wav	ส่วนวิญญาณที่สิงอยู่ในตัวของนายสมหวัง<MARK>
7-7192-99.wav	นายสมหวัง<MARK>กับภรรยายังไงไม่เคยตรวจร่างกาย
7-7193-77.wav	ยินดีค่ะคุณทัศนาย<MARK>สวัสดีค่ะ
7-7198-7.wav	ส่วนวันชายหาด(วันชายหาด,วอลเลย์บอลชายหาด)อายุต่ำกว่า21(ยี่สิบเอ็ด,21)ปีชิงแชมป์โลกที่จังหวัดอุดรธานีครับ
7-7204-141.wav	นี่คือคำอธิบายที่ตอบคำถามนายกว่า(นายกว่า,นายกฯ)
7-7204-78.wav	หมูเพิ่มเข้ามาในตลาดได้เร็วอย่างที่นายกว่า(นายกว่า,นายกฯ)
7-7205-13.wav	อยู่นายวิทูลย์(วิทูลย์,วิทูรย์)ก็เอามีดจ้วงแทงแบบไม่ยั้งต่อหน้าเพื่อนเลยค่ะ
7-7205-15.wav	เมื่อตอนเช้าตำรวจจับได้แล้วค่ะนายวิทูลย์(วิทูลย์,วิทูรย์)
7-7199-1.wav	แต่มาเรื่องนี้ก่อนเลยครับเป็นนโยบายเปิดสถานบันเทิงถึงตี44ในพื้นที่นำร่องด้านการท่องเที่ยว4จังหวัด
7-7205-17.wav	ฮะเออนะคะตำรวจสอบประวัติแล้วพบว่านายวิทูลย์(วิทูลย์,วิทูรย์)เนี่ย
7-7205-21.wav	จากการสอบสวนทราบว่านายวิทูลย์(วิทูลย์,วิทูรย์)เนี่ยถามผู้ตายบอกห้อยพระอะไร
7-7205-23.wav	จากนั้นนายวิทูลย์(วิทูลย์,วิทูรย์)พูดในธรรมนองบอกอยากลองของผู้ตายก็ปฏิเสธเนี่ย
7-7205-25.wav	แต่ว่านายวิทูลย์(วิทูลย์,วิทูรย์)ก็ชักมีดออกมาแทงผู้ตาย
7-7205-27.wav	ยังนั่งกินเหล้ากันอยู่หลังพ้นโทษนายวิทูลย์(วิทูลย์,วิทูรย์)มาทำงานดูแลตลาดคลองเตย
7-7205-29.wav	ตำรวจเนี่ยตอนที่คุมตัวมาที่สน.ท่าเรือนายวิทูลย์(วิทูลย์,วิทูรย์)ก็ยอมรับบอกว่าต้องการจะลองของ
7-7205-36.wav	แต่เพื่อนของนายอัธพล(อัธพล,อรรถพล)ที่วันนี้ที่เขาไปที่สน.ท่าเรือ
7-7205-9.wav	ใช่ค่ะคุณวิทูล(วิทูล,วิทูรย์)หรือว่าในเสือ(ในเสือ,นายเสือ)คนเสื้อขาวนายอรรถพล<MARK>หรือว่านายหนุ่ม<MARK>
7-7206-14.wav	สิทธิ์(สิทธิ์,ผู้สื่อข่าว)ของเราสอบถามไปยังนางสาววัชิรญาณ(วัชิรญาณ,วชิรญา)ผู้ดูแลหอพักที่เกิดเหตุ
7-7209-28.wav	สำหรับนายนาเฟลฮัสซัน<MARK>และนายมูยาไทยติ<MARK>
7-7209-32.wav	ส่วนนายอับดุลอาซิสอารุก<MARK>ตำรวจได้เชิญตัวจากหอพักแห่งหนึ่งในซอยสุขุมวิท4(สี่,4)
7-7209-7.wav	ซิสอารุก(ซิสอารุก,อับดุลอาซิสอารุก)อายุ44(สี่สิบสี่,44)ปีนายนาเฟลฮัสซัน<MARK>อายุ34(สามสิบสี่,34)ปี
7-7209-8.wav	และนายมูยาไทยติ<MARK>อายุ29(ยี่สิบเก้า,29)ปีชาวซีเรีย
7-7214-11.wav	ก็คือนายวิชญ์ชอบสุรินทร์(วิชญ์ชอบสุรินทร์,วิชชอบสุรินทร์)อายุ52(ห้าสิบสอง,52)ปีนะครับ
7-7214-25.wav	เป็นเบอร์ของเจ้าของอู่รถแล้วก็เป็นหลานชายของนายวิชญ์ชอบ(วิชญ์ชอบ,วิชชอบ)คนนี้ด้วย
7-7214-26.wav	ทีนี้ก็ถามนายวิชญ์ชอบ(วิชญ์ชอบ,วิชชอบ)บอกว่านี่เจ้าของอู่กับหลานชายเนี่ย
7-7214-27.wav	ญาติพี่ใช่ไหมนายวิชญ์ชอบ(วิชญ์ชอบ,วิชชอบ)บอกจำไม่ได้
7-7214-32.wav	ปรากฏว่าตัวนายวิชญ์ชอบ(วิชญ์ชอบ,วิชชอบ)เนี่ย
7-7214-39.wav	ที่มาช่วยกันทวนความจำให้กับนายวิชญ์ชอบ(วิชญ์ชอบ,วิชชอบ)เนี่ยนะครับ
7-7214-42.wav	จอดรถใกล้กับรถแท็กซี่ของนายวิชญ์ชอบ(วิชญ์ชอบ,วิชชอบ)เลย
7-7214-46.wav	และนายวิชญ์ชอบ(วิชญ์ชอบ,วิชชอบ)ก็หันมาหาพี่โชเฟอร์แท็กซี่คันอื่น
7-7214-50.wav	แล้วก็หญิงในปลายสายก็บอกว่าให้บอกนายวิชญ์ชอบ(วิชญ์ชอบ,วิชชอบ)หน่อย
7-7214-53.wav	เขาก็มารู้ว่าปลายสายที่นายวิชญ์ชอบ(วิชญ์ชอบ,วิชชอบ)พูดคุยอยู่นั้น
7-7214-54.wav	ก็คือเจ้าของอู่รถแท็กซี่นะครับแล้วก็เดินทางมาหานายวิชญ์ชอบ(วิชญ์ชอบ,วิชชอบ)ที่ปั๊มแห่งนี้นะครับ
7-7214-57.wav	ก็พูดเป็นเสียงเดียวกันบอกว่านายวิชญ์ชอบ(วิชญ์ชอบ,วิชชอบ)เนี่ยไม่เคยมีอาการลักษณะนี้มาก่อนนะครับ
7-7214-58.wav	ซึ่งทุกคนก็กลัวว่านายวิชญ์ชอบ(วิชญ์ชอบ,วิชชอบ)อาจจะโดนป้ายยาหรือเปล่า
7-7214-60.wav	ทางตำรวจนะครับก็แนะนำให้ญาตินำตัวนายวิชญ์ชอบ(วิชญ์ชอบ,วิชชอบ)ไปหาหมอก่อน
7-7214-63.wav	ถ้าทางญาติสงสัยว่านายวิชญ์ชอบ(วิชญ์ชอบ,วิชชอบ)ถูกป้ายยาก็ขอให้มาแจ้งความไว้ที่สภ.ปากเกร็ด
7-7214-65.wav	จากการตรวจสอบที่ตัวของนายวิชญ์ชอบ(วิชญ์ชอบ,วิชชอบ)แล้วก็ตรวจสอบภายในรถของนายวิชญ์ชอบ(วิชญ์ชอบ,วิชชอบ)
21-21520-37.wav	ก็ต้องช่วยกันจับตัวกดตัวลงพื้นระหว่างนั้นนายสังวานระเม็กอายุสี่สิบสองปี
21-21520-43.wav	ใช้ปืน9มมเป็นปืนพกประจำกายยิงใส่นายสังวาน
21-21520-52.wav	ท่านผู้ชมครับวันนี้นะฮะญาติญาติของนายสังวานนะฮะ
21-21520-53.wav	พ่อแล้วก็ญาติพี่น้องไปรับศพนายสังวานจากโรงพยาบาลนะครับ
21-21520-79.wav	ระหว่างนั้นนายสังวานเห็นน้องชายถูกจับก็เลยไปหยิบมีดพระเนี่ยวิ่งเข้าหาตำรวจ
21-21520-80.wav	ตำรวจเอกคมกริจได้ยิงขู่ลงพื้นหนึ่งนัดแล้วก็ผลักนายอรุณออกจากตัวไปก่อน
21-21520-83.wav	กระสุนเนี่ยเข้าลำตัวนายสังวานก็เสียชีวิตคาที่
21-21520-85.wav	ตอนนั้นตำรวจก็ช่วยกันปั๊มหัวใจนายสังวาน
21-21520-89.wav	ตำรวจก็แจ้งข้อหากับนายสังวาน3ข้อหา
21-21520-90.wav	นายสงวัลนี่คือผู้ตายนะถูกแจ้งข้อหานี่ฮะ
21-21522-22.wav	เทศบาลเมืองสองพี่น้องถนนสายบางลี่วัดป่าเลไลจังหวัดสุพรรณบุรี
21-21522-46.wav	จากนั้นตำรวจก็ได้เรียกนางพิษสมัยทองคำอายุ35ปีผู้โพสต์
21-21522-50.wav	ซึ่งนางพิษสมัยให้การภาคเศษรับว่าเป็นผู้โพสต์คลิปจริง
21-21527-109.wav	ศักดิ์สยามชิดชอบนายสุภาชัยโพสุพร้อมทีมพยาบาลก็ขึ้นไปดูนายชัยชิดชอบปู่ชัยนะคะ
21-21527-113.wav	ก็ความเคลื่อนไหวนะครับหลังจากประชุมสภากันในวันนี้นะครับแล้วก็เลือกประธานสภาผู้แทนรัศดรไปแล้วนะครับวันนี้นายสุริยะจึงรุ่งเรืองกิจสอสอแกนนำพักพลังประชารัฐบอกว่าไอ้คะแนนที่เพิ่มมาจะ5จะ6เสียงเนี่ยก็ไม่รู้ว่ามาจากภักดิ์ไหนอะไรยังไงนะครับแต่น่าจะเป็นเสียงที่เห็นว่าในชวนมีความเหมาะสมสำหรับการป
21-21527-11.wav	ที่มีนายชัยชิดชอบสส.พรรค์ภูมิใจไทย
21-21527-17.wav	ที่มีคำสั่งให้นายธนทรจึงรุ่งเรืองกิจ
21-21527-20.wav	นายธนทรพยายามจะขอใช้สิทธิ์ในการพูดรับทราบมติ
21-21527-22.wav	ประธานก็แจ้งนายธนทรแล้วว่าทำไม่ได้จะพูดไม่ได้นะคะ
21-21527-23.wav	แต่นายธนทรเองก็ใช้โอกาสที่คนเขาก็โตเถียงกันนะคะ
21-21527-33.wav	ก็จะขาดเสียงของนายธนทรไปหนึ่งเสียงนะฮะ
21-21527-96.wav	พลังประชารัฐก็เลยต้องเสนอนะครับและนายนัทพลทีพสุวรรณสส.พลังประชารัฐ
21-21527-99.wav	นายชวนหลีกภัยจากภักดิ์ประชาธิปัตย์ได้รับเลือกให้เป็นประธานสภาผู้แทนรัศดร
21-21529-10.wav	ในแก๊งนี้ไปมอบตัวกับพลตำรวจตรีถากูลเนธพุกณะผู้บังคับการตำรวจภูธรจังหวัดพัทลุง
21-21533-10.wav	หนองนาคอำเภอหนองแคร์จังหวัดสระบุรี
21-21534-11.wav	และคุณภรรยาก็คือนางกุญจิราสุขโสมนะครับก็ช่วยกันทำขนมพื้นบ้านจากภาคใต้นี่แหละครับ
21-21538-0.wav	การเดินทางไปวัดเจดีนั้นไม่ยากครับเพียงแค่ออกจากตัวเมืองนครศรีธรรมราชมุ่งหน้าไปยังอำเภอศรีชนประมาณห้าสิบกิโลเมตรเราก็จะเริ่มเข้าเขตวัดเจดีกันแล้วครับสังเกตได้จากสองข้างทางจะมีไก่ตัวใหญ่ที่มีคนนำมาถวายให้ไอ้ไข่เรียงรายไปตลอดเส้นทางจนถึงวัดครับ
21-21538-40.wav	มีคนเดินทางมาแก้บนกับไอ้ไข่ตลอดทั้งวันเช่นกัน
21-21541-0.wav	ที่จังหวัดแพร่ไปตามหาโจรกันหน่อยเขาไป
21-21541-13.wav	ทีนี้ชาวบ้านที่เขาเฝ้าสวนอยู่ชื่อว่านายโรธ
21-21541-20.wav	แล้วก็ในพื้นที่ตำบลห้วยม่ายตำบลทุ่งน้าวของอำเภอ2จังหวัดแพร่
21-21546-11.wav	คุณแม่ก็ไปมีครอบครัวใหม่อยู่ที่อำเภอละงูจังหวัดสตูล
21-21546-31.wav	ึงรถไปเลยจากนครนายกไปที่จังหวัดสตูล
21-21546-2.wav	ต้นทางอยู่ที่จังหวัดนครนายก
21-21546-5.wav	เพราะว่าที่จังหวัดสตูลมีคุณแม่เขารออยู่ที่ไม่ได้เจอกันกว่า40คน
21-21549-22.wav	ก็ได้เดินทางมาที่บ้านบีดาของพันธุ์ตำรวจโทสันทนาและสื่อมวลชน
21-21549-35.wav	ตำรวจโทสันทนาเองก็ได้เดินทางพร้อมกับทนายความส่วนตัว
21-21550-105.wav	สพขุนทะเลบอกว่าจากการสอบสวนนายปียพงศ์มือยิงนะครับ
21-21553-7.wav	นายสุธิพงศ์มะโนวงค่ะอายุ34ปี
21-21555-36.wav	นี่แหละครับนายเอกพบเหลืองประเสริฐ
21-21556-3.wav	เมื่อวานนี้ค่ะได้ไปพบกับนายสมคิตจาตุศีพิทักษ์รองนายกรัฐมนตรี
21-21556-7.wav	จากนี้นายแจ๊คหมายยังได้ขึ้นเวทีบรรยายพิเศษในหัวข้อเกี่ยวกับการส่งเสริมผู้ประกอบการในยุคโลกาพิวัฒน์ด้วย
21-21564-40.wav	แล้วก็ตัวของนายพีชนายตูนก็พยายามถาม
21-21565-1.wav	ก่อนจะถึงคืนหมาหอนไปที่สงขลาตำรวจสภหัดใหญ่จังหวัดสงขลา
21-21565-2.wav	คุมตัวนายวินัยอายุห้าสิบเก้าปีขับรถฟอร์จูเนอร์มาอยู่ที่
21-21565-5.wav	นี่นายวินัยมาแจกเงินซื้อเสียงนะให้กับผู้สมัครพักการเมืองดัง
21-21570-27.wav	นายสนิทพรมวงศ์อธิบดีกรมการขนส่งทางบกบอกว่า
21-21570-33.wav	นายประยูนช่วยแก้วรองผู้อำนวยการฝ่ายการเดินรถองค์การขอสมกบอกว่า
21-21571-9.wav	คนที่ถูกทำร้ายเนี่ยคือนายสุธนดอกไม้นะครับ
21-21573-19.wav	ท้าเวสวันที่วัดสนามชัยมีชาวบ้านและนักท่องเที่ยวเดินทางมากราบไหว้ที่นี่กันเยอะ
21-21573-8.wav	วันก่อนสาววัย29ชาวจังหวัดอยุธยา
21-21574-13.wav	ทุมธานีค่ะซึ่งสารอนุมัติหมายจับนายสมชายในข้อหาฆ่าผู้อื่นแล้ว
21-21574-19.wav	แล้วก็นางจำปีโอภาษพินิษฐ์อายุ53ปีแม่ของผู้ตายแล้วก็ญาติด้วย
21-21574-3.wav	กำลังอยู่ระหว่างติดตามจับกลุ่มพ่อตารายนี้นะคะความคืบหน้าเหตุนายสมชายจาดมีหรือช่างชายอายุสี่สิบห้าปีที่ก่อเหตุใช้มีดอิโต้ฟันนายประเสริฐพันเอกหรือไก่
7-7214-66.wav	จะไม่พบกระเป๋าสตางค์นะครับพบเพียงเงินสด160บาทในกระเป๋าเสื้อของนายวิชญ์ชอบ<MARK>เท่านั้น
21-21575-17.wav	ซึ่งเรื่องนี้นายจักริจเข็มทองนายกสมาคมป้ายและโฆษณาบอกเลยนะคะว่า
21-21576-21.wav	พี่สาวของนายสุรชัยที่เสียชีวิตชื่อนางมณีรัฐนะครับบอกว่าน้องชายเนี่ยเป็นช่าง
21-21576-23.wav	เมื่อวานเนี่ยตอนเกิดเหตุเนี่ยน้องชายมาเกี่ยวข้าวในที่นาของพี่สาวก็คือนางมณีรัฐ
7-7215-13.wav	นายสมพร<MARK>ที่เป็นคนก่อเหตุนะครับ
7-7215-14.wav	เป็นญาติกับคนเจ็บด้วยคนเจ็บคือนางทัศนีย์<MARK>นะครับ
7-7215-15.wav	พาทีมข่าวเราไปดูพื้นที่บอกว่านางทัศนีย์<MARK>ปกติจะนอนเล่นที่แคร่ใต้ถุนบ้านเป็นประจำ
7-7215-16.wav	เมื่อวานเนี่ยนอนหลับอยู่นายสมพร<MARK>สามีมาถึงใช้มีดเนี่ยฟันก่อนเลยนะครับ
7-7215-21.wav	หลังจากที่เมียเก่าของนายสมพร<MARK>เขาเสียชีวิตไปแต่เมื่อห้าหกเดือน(ห้าหกเดือน,5-6เดือน)ก่อน
7-7215-22.wav	นายสมพร<MARK>เริ่มใช้ความรุนแรงแล้วใช้มีดฟันศีรษะนางทัศนีย์<MARK>มาแล้ว
7-7215-25.wav	ดูความโหดร้ายของนายสมพร<MARK>นะฮะมันทำเหมือนเขาไม่ใช่คนเลยอ่ะ
7-7215-29.wav	นายสมพร<MARK>เองมีลูกสาวกับภรรยาเก่าบางทีลูกมารับกลับไปอยู่ที่บ้านลูก
7-7215-30.wav	นายสมพร<MARK>ก็ไม่อยู่กับลูกกลับมาอยู่กับนางทัศนีย์<MARK>อีก
21-21580-18.wav	ซึ่งนอกจากบุกไปครัวแล้วนะฮะทางด้านของผู้จัดการร้านนางสาวกัญญานัทชูเขียว
7-7215-48.wav	วันนี้ตำรวจคุมตัวนายสมพร<MARK>ไปสอบปากคำนะครับนายสมพร<MARK>คือเขาบอกว่าเขาไม่ได้ทำร้ายร่างกายภรรยานะฮะ
21-21580-23.wav	นี่แหละครับนางสาวกัญญนัทชูเขียวผู้จัดการ
21-21580-2.wav	นักท่องเที่ยวจีนที่เดินทางเข้ามาเที่ยวในบ้านเรา
7-7215-67.wav	ลูกสาวของนายสมพร<MARK>นะบอกว่าพ่อแล้วก็คนเจ็บซึ่งเป็นแม่เลี้ยงเนี่ย
7-7215-90.wav	คือไปตรวจสอบประวัติของนายสมพร<MARK>ที่ลูกสาวเขาบอกเนี่ย
