filename	text
0-646-95.wav	ถึงไปดิวจับมือกับนายสนทิลิ้มทองกุล
0-646-97.wav	เมื่อวานนี้นายนัทวุฒิสายเกลือแก่นำกลุ่มนปชก็บอกว่า
0-647-0.wav	เอาเป็นว่าณขณะนี้เนี่ยเรายังมีทีมหมูป่าที่อยู่ในถ้ำหลวงขุนน้ำนางนอนที่อำเภอแม่สายจังหวัดเชียงราย
0-647-144.wav	นี่คือสิ่งที่เกิดขึ้นในวันนี้นะครับท่านผู้ชมครับสำหรับปฏิบัติการทั้งหลายที่อยู่ในถ้ำหลวงจังหวัดเชียงรายนะครับ
0-647-17.wav	เอาเป็นว่าเดี๋ยวผมพาไปดูในถ้ำหลวงขุนน้ำนางนอน
0-647-20.wav	สำหรับคนที่ติดอยู่ในถ้ำหลวงขุนน้ำนางนอนนะครับ
0-647-23.wav	ผมจะลงไปที่จุดเนินนมสาวในถ้ำหลวงที่จังหวัดเชียงราย
0-647-29.wav	ผมมาถึงจุดเนินนมสาวในพื้นที่ของถ้ำหลวงขุนน้ำนางนอนแล้วครับ
0-647-6.wav	ว่าเดินทางออกจากจุดเนินนมสาวจริงเนี่ยประมาณบ่ายสองนะ
0-647-8.wav	แต่ละคนที่เดินทางออกมาใช้เวลาสักประมาณเกือบสี่ชั่วโมงค่ะก็ถือว่าเร็วกว่าเร็วกว่า
0-648-32.wav	จังหวัดปทุมธานีนะครับ
0-648-46.wav	พบว่าก็คือนายสิริชัยพออบเหล็กอายุ31ปี
0-648-50.wav	นายสิริชัยบอกว่าเหตุการณ์เกิดขึ้นเมื่อวานนี้
0-649-13.wav	เดินทางมาจากกรุงลอนดอนประเทศอังกฤษวันที่28กุมภาพันธ์
16-16260-53.wav	คนที่ถูกยิงเสียชีวิตชื่อนายสุขสรรคเสวาพันธ์ถูกยิงที่ศีรษะ
0-652-14.wav	ก็เดินทางกันไปต่อค่ะนี่แหละค่ะตามที่เช็คอินสารแม่ฮันนี่
0-652-30.wav	แล้วมันก็ราบรื่นประสบความสำเร็จจริงจริงคุณผู้ชมแล้วก็เลยเดินทางมาแก้บน
0-652-40.wav	มาพร้อมกับมิสแกรนด์ศรีสะเกษเดินทางมาที่งานด้วย
0-652-5.wav	เดินทางไปแก้บนที่ศาลแม่ฮันนี่ศรีอีสานตอนนี้หลายคนบอกศรีสะเกษ
0-654-18.wav	ยิงบ้านพักของอดีตพบเรือนจำจังหวัดตรัง
0-654-8.wav	คือนายดรุนหรือว่าบังหมุดโคกทราย
0-654-9.wav	ซึ่งเป็นพ่อค้าเนื้อวัวรายใหญ่ของจังหวัดตรัง
0-656-0.wav	คุณผู้ชมฮะได้เวลาตรวจสอบกันที่จังหวัดเพชรบุรีกันแล้วนะครับ
0-656-15.wav	ขณะที่นายกรัฐมนตรีมีการปรับแผนในการเดินทาง
0-656-16.wav	ปรากฏว่าพรุ่งนี้นายกจะเดินทางไปที่เพชรบุรีนะครับ
0-656-19.wav	โดยจะไปตรวจสอบสถานการณ์น้ำท่วมที่จังหวัดเพชรบุรีวันที่8สิงหาคม
0-656-25.wav	ซึ่งจริงแล้วกำหนดการเดิมของนายกรัฐมนตรีนะครับ
0-656-40.wav	ส่วนคำเปิดเผยของนายสมเกียจประจำวงเลขาธิการ
0-656-6.wav	แล้วก็ใช้เวลาประมาณ1012ชั่วโมงในการเดินทางเข้าสู่เขื่อนเพชร
0-656-76.wav	แล้วก็จังหวัดเพชรบุรียังต้องเฝ้าระวังฝนรอบ2ของฤดูฝนต่อไป
0-657-25.wav	ผู้ปกครองก็เดินทางไปแจ้งความที่สภ.เมืองสมุทรสาคร
0-658-13.wav	นางรสสุคลถูกจับได้บริเวณสถานีขนส่งอาเขตเชียงใหม่ที่3
0-658-9.wav	นี่ก็คือนางรสสุคนมีสมศักดิ์นะครับ
0-661-10.wav	เขาเล่าให้ฟังบอกว่าตัวเองเนี่ยเป็นคนจังหวัดจันทบุรี
0-661-26.wav	คือโพสต์ของแฟนสาวของนายกันตินันหรือว่าน้องคิวนี่แหละโพสต์ไว้อะไรหลังจากที่ต้องสูญเสียคนรัก
0-661-32.wav	ส่วนการจักรไปของอีกหนึ่งบุคคลนายประกาศิษรัตนตันหยงเจ้าหน้าที่บริการวิทยาศาสตร์คณะแพทยศาสตร์จุฬามหาบัณฑิตสาขาวิชาวิทยาศาสตร์การแพทย์คณะแพทยศาสตุลาลงกรมหาวิทยาลัย
0-661-39.wav	พรมพฤษและนายประกาศิษย์มาณที่นี้ค่ะ
0-663-18.wav	ที่จะเดินทางมายังนครริโอ
0-663-50.wav	นางอังเรยุงดีนักโบราณคดีที่เพิ่งกลับมาทำงานบูรณคดีอีกครั้ง
0-663-73.wav	อาศัยอยู่ที่นี่ก่อนที่ชาวโปรตุเกตจะเดินทางมาถึง
0-663-63.wav	นางธานีอังราดีลิมานักโบราณคดีได้เล่าว่า
0-665-0.wav	ผู้ชมครับท่านที่อยู่ที่จังหวัดตรังนะครับอยู่ในพื้นที่แถวแถวคลองปะเหลียนนะไม่รู้ว่าท่านเคยได้ยินเรื่องราวเรื่องของความอาถรรพ์ตัวตายตัวแทนหรือเปล่านะเพราะว่าล่าสุดค่ำเมื่อวานนี้เนี่ยมีผู้ที่ว่ายน้ำข้ามคลองแล้วก็เสียชีวิตค่ะแต่เป็นศพที่สี่แล้วนะฮะตรง
0-665-13.wav	นายจักรพงศ์จมน้ำเสียชีวิตอยู่กลางคลองห่างจากตลิ่งประมาณ
0-665-16.wav	ที่จะต้องไหว้ข้ามไปเนี่ยนะครับนายสายันอายุ65ปีเป็นคนที่
0-665-17.wav	เห็นเหตุการณ์นะครับบอกว่าโดยปกติแล้วเขาจะเห็นนายจักรพงศ
0-665-29.wav	ขณะที่ชาวบ้านในพื้นที่อีกคนนึงนะครับชื่อว่านาง
0-665-34.wav	คลองแห่งนี้มีคนจมน้ำเสียชีวิตมาแล้วสามศพนายจักรพงศ์
0-665-44.wav	อายุ33ปีส่วนนายจักรพงศ์หรือว่าในกรดนะฮะอายุ39ปี
0-665-50.wav	เจอกับนายเจริญเกียงเอียอายุ72
16-16262-14.wav	กรทมท่านหนึ่งทราบว่าคนที่ถูกแทงชื่อนายโอ๊ปนะครับนายโอ๊ปอาการปลอดภัยแล้ว
16-16263-0.wav	เรียนท่านประธานสภาดิฉันเบนจาแสงจันทร์สมาชิกสภาพผู้แทนราชดรพักเก้าไกรจังหวัดชลบุรีค่ะ
16-16263-1012.wav	ผมละนายวิพันธ์เพื่อไทยอำนาจเจริญครับผมประท้วงท่านประธานตามข้อเก้า
16-16263-1067.wav	นายกรรมตรีที่เป็นผู้รับผิดชอบตรงหรือไม่ครับ
16-16263-1164.wav	สมาชิกสภาพผู้แทนรัศดรจังหวัดเชียงรายพักเพื่อไทย
16-16263-229.wav	อภิปรายนั้นก็คือมุ่งไปที่นายกรรมตรีนะครับ
16-16263-281.wav	คือการบริษัทเอกชนนั้นมีการเอื้อประโยชน์กันระหว่างนายกรรมตรีกับทุนผูกขาดนั้นอย่างไร
16-16263-377.wav	ไม่เคยรักษาการนายกรมนตรีนะครับ
16-16263-822.wav	ครับก่อนท่านนายกรมนตรีจะตอบ
0-665-51.wav	ปีเป็นชาวบ้านในพื้นที่นายเจริญเล่าว่า
0-665-58.wav	นายเจริญบอกว่าเมื่อหลายปีก่อนขณะที่เขาอยู่บนบ้าน
16-16263-824.wav	ท่านถามว่าผมมีอำนาจอะไรใช้อำนาจอะไรในการให้นายกรมนตรีชี้แจง
16-16265-43.wav	นายวันนบลูกชายคนโตของยายนีเนี่ยเล่าบอกว่า
16-16269-15.wav	เกิดขึ้นที่หน้าตลาดช้อยริมถนนสายเบนจมะบางปูตะบลนาซายที่อำเภอเมืองจังหวัดนครศรีธรรมราช
0-668-30.wav	เดี๋ยวดิฉันนะคะจะพาไปพูดคุยกับนายนันทวัฒน์นะคะสายปานค่ะ
16-16269-43.wav	หลังเกิดเหตุผู้เสียหายรายนี้เขาก็เดินทางไปแจ้งความไว้กับตำรวจสภเมืองนครศรีธรรมราชแล้ว
16-16270-3.wav	ในจังหวัดอุดรธานีโพสต์ภาพถ่ายอธิธาตุของพระอาจารย์สุดใจ
16-16271-25.wav	ศรีขอรภูมิจังหวัดสุริน
16-16275-102.wav	ภัยบอกพอช่วยมาถึงเนี่ยนะฮะเอาศพมาส่งถึงวัดเนี่ยนางสุดที่เป็นแม่ของผู้ตายยื่นเงินให้ทีมกู้ภัย200บาท
16-16275-104.wav	กู้ภัยก็เลยต้องบริจาคเงินค่าโรงศพให้นะฮะนี่ฮะนายสมชายนะฮะผู้ตายนะครับ
0-669-21.wav	ไม่ให้ความเห็นชอบนายพิธาริมเจริญรัฐ
0-669-238.wav	ผู้ที่จะได้รับการเสนอชื่อให้เป็นนายกรัฐมนตรีนั้นให้เลือกมาจากผู้ที่มีชื่อ
16-16275-15.wav	อดศพนายสมชายอายุ42ที่เป็นลูกชายอยู่ที่ริมสะน้ำ
16-16275-24.wav	นี่คือศพของนายสมชายลูกชายนะครับ
16-16275-88.wav	ผู้ชมครับเราได้คุยกับเพื่อนบ้านของนางสุดนะฮะ
16-16275-91.wav	ก็คือนางปุญญนุษย์เนี่ยนะฮะ
0-669-84.wav	นายชัยธวัฒน์บอกว่าสสจากก้าวไกลได้ลงชื่อตาม10รัฐธรรมนูล
16-16275-95.wav	แต่นางสุดบอกว่าเออไม่เป็นไรหรอกเดี๋ยวเขาจะค่อยผูกทุ่นลอยอะไรพวกนี้ไปเก็บนะครับ
16-16275-99.wav	ศพของนายสมชายเนี่ยไปที่วัดโคกงิ้วนะครับในพื้นที่ตำบลประคำที่บ้านนั่นแหละนะฮะ
16-16276-33.wav	เนี่ยค่ะตำรวจภูธรเมืองสมุทรสาครคุมตัวนายรณชัยตุ้มนินการ
16-16276-50.wav	แต่นายรณชัยที่ชักปืนมาจากเอวของผู้ใหญ่บ้าน
16-16276-59.wav	ซึ่งนายรณชัยผู้ต้องหาเขาปฏิเสธในข้อหาพยายามฆ่านะคะ
16-16276-67.wav	ก็อยู่กับเพื่อนก็มีนายรณชัยรวมอยู่ด้วย
16-16276-72.wav	ชื่อว่านายบงกฎลาเฟ้ยอายุ30
16-16276-77.wav	นายรณชัยที่เป็นรุ่นน้องคนสนิทของผู้ใหญ่บ้าน
16-16276-85.wav	ถูกนายบงกฎคนที่ถือขวดเบียร์ไปตีหัวผู้ใหญ่
16-16277-107.wav	ของประชาชนคนไทยที่เดินทางมายังศาลาสิริราชร้อยปีแห่งนี้
0-677-59.wav	ก็คุยกันวันอังคารที่ผ่านมาก่อนที่ผมจะเดินทางไปพม่า
0-678-36.wav	ทราบชื่อต่อมาก็คือนางนัทธนันสุริยโรธและเด็กชายถิติศักดิ์สุริยโรธ
16-16277-11.wav	ประชาชนที่เดินทางมาอย่างโรงพยาบาลสิริราชแห่งนี้
16-16278-53.wav	แล้วก็พากันเดินทางกลับบ้านไปค่ะอืมโถหนูอายุสิบสี่เองนะลูก
16-16279-43.wav	ประชาชนชาวบ้านไม่ต้องเดินทางไปในตัวเมืองเพื่อไปตัดผม
0-679-58.wav	นี่มีนายไพโรธพัฒศาสตร์อายุ42ปีชาวบ้านเรียกว่าอาจารย์ไก่
16-16281-16.wav	ข้างบ้านไปพบศพนายประโยคจันส่งแสงอายุ52ปี
0-680-102.wav	ลูกชายของเธอขับขี่รถมอเตอร์ไซค์มาแล้วก็พานายวสันเนี่ย
0-680-105.wav	นายวสันจะกลับกรุงเทพเธอก็เอ๊ะเพิ่งมาอยู่
0-680-109.wav	นายวสันเคยติดคุกคดีรักทรัพย์มาแล้วคุณชนะคุณผู้ชม
16-16281-37.wav	ทีนี้ต่อมานายนาราธิบคงหวังวัย28ปี
16-16281-43.wav	ที่กำลังเจรจากับนายนาราธิบอยู่หน้าบ้าน
16-16281-47.wav	มาที่บ้านนายสมศักดิ์พ่อของนายนาราธิบ
16-16281-53.wav	นายสมศักดิ์แล้วก็นายนาราธิบวิ่งเข้าไปในบ้าน
16-16281-54.wav	ก่อนที่นายนาราธิบจะคว้าปืนลูกซองยาวยิงสวนออกมาหลายนัด
16-16281-55.wav	ถูกนายประโยคพลุนไปทั้งร่างเสียชีวิตในที่เกิดเหตุ
16-16281-56.wav	หลังก่อเหตุนายนาราธิบก็หลบหนีไปบ้านญาติ
0-680-206.wav	คือนายชาวกิจสุวรรณคีรีให้นำกำลังไปที่ร้านร้านนี้
0-680-209.wav	พอไปถึงก็ไปพบกับเจ้าของร้านชื่อว่านางสาวระนิดาคงพันธ์ค่ะ
0-680-292.wav	พอมาปั๊บเนี่ยก็เดินทางไปหาตาชั้น
0-680-294.wav	หมอปลาเดินทางไปเลยไปเจอกับตาชั้น
0-680-412.wav	ก็คือนายภูเมษสุธิวารีอายุ32ปีค่ะ
0-680-414.wav	คือก่อนหน้านี้นางสาวโสพีเกษีอายุ36ปี
0-680-415.wav	พี่สะใภ้ได้แจ้งความบอกว่านายภูเมฆเกิดอาการคลุ้มคลั่ง
16-16281-58.wav	ล่าสุดนายนาราธิบผู้ก่อเหตุก็เดินทางเข้ามอบตัวกับตำรวจสภ.ทุ่งใหญ่แล้ว
0-680-88.wav	เป็นนี่แหละผู้ชายคนที่เป็นโจรที่ว่านี่นะคือนายวสันราชมนตรีอายุ38ปีค่ะ
16-16282-21.wav	นายบุญฤทธิไม่พอใจน้องสาวที่ชอบสูบบุหรี่ในบ้านเป็นทุนเดิม
0-684-133.wav	ท่านก็ได้รับรายงานเพิ่มเติมจากนางสาวพันนภา
0-684-54.wav	พูดคุยกับนางสาวพันนภาจันทรารมครับ
0-685-28.wav	แล้วไปเจอผู้เสียชีวิต1รายทราบชื่อภายหลังคือนางปัชญานีกังสดานพิพบอายุ59ปี
0-685-36.wav	ก็คือทางด้านของคนขับรถแท็กซี่ชื่อว่านายประเสริฐทิพย์ศรี
0-688-28.wav	ส่วนที่เยอรมนีนะครับคุณผู้ชมเมื่อวันพุธที่ผ่านมานางมาเรียโบเมอร์รัฐมนตรีช่วยว่าการกระทรวงต่างประเทศ
0-688-32.wav	รินครับโดยนายธีรวัตรภูมิจิตเอกอัครราชทูตไทยในกรุง
0-688-45.wav	นายมาริสเสงี่ยมพงศ์เอกอัครราชทูตไทยในกรุงเวลลิงตัน
0-688-7.wav	และนางสาวพบจันลีลาศาสสุนทรครูใหญ่บ้านเรียนละครมรดกใหม่
0-689-23.wav	ตัวสามีชื่อว่านายกิตินัทศิวะพิทักพงศ์อายุสามสิบเก้า
8-8001-9.wav	ที่เกิดเหตุค่ะไปพบศพนางคำปิ่นกาลพลึกอายุ50ปีค่ะ
8-8004-34.wav	แน่นอนว่าทำให้ชาวบ้านคือสะดวกสบายช่วยย่นระยะเวลาในการเดินทางไปยังอำเภอใกล้เคียง
8-8004-9.wav	ฝั่งอำเภอดอยสะเก็ดของจังหวัดเชียงใหม่คุณดูนะ
8-8007-29.wav	ก่อนหน้านี้นายสมเกียจทงศรีผู้ตรวจราชการสำนักงานพระพุทธศาสนาแห่งชาติ
8-8007-9.wav	เข้าแจ้งให้พระปลัดเสกสรรเดินทางไปรายงานตัวฐานขัดคำสั่งหัวหน้าคสช.ค่ะ
8-8008-19.wav	โดยนางวันเพ็ญม่วงเอี่ยมเจ้าของร้านอาหารเจ๊เพนข้าวแกงตามสั่ง
16-16282-46.wav	ทำให้นายบุญฤทธิมักต่อว่าเสมอว่าห้ามสูบบุหรี่ในบ้าน
16-16282-49.wav	จากนายบุญฤทธิ์จะเป็นไม้เบื่อไม้เมากับนางสาวกิติยาน้องสาวแท้แล้ว
16-16282-53.wav	พนักงานสอบสวนนำตัวนางสาวกิติยาไปสอบปากคำที่โรงพัก
16-16282-9.wav	ภายหลังจากที่นางสาวกิติยานวลลมวัย39ปี
16-16283-12.wav	ชนรับประทานจังหวัดต้องวางแผนการระบายน้ำใหม่
16-16283-30.wav	ซึ่งสถานการณ์เองตอนนี้ก็ถือว่ายังต้องเฝ้าระวังค่ะวงกฎจุ้ยนิ่มรายงานจากเขื่อนแก่นกระจานจังหวัดเพชรบุรีค่ะ
0-699-42.wav	ชื่อคุณลุงสำรวยมูลเสนาค่ะเป็นชาวจังหวัดกาฬสินธุ์
0-700-14.wav	ก็เลยเดินทางไปแจ้งความกับตำรวจคือร้อยตำรวจเอกกิติพันธ์โปร่งคำ
0-700-25.wav	ก็พูดคุยกับผู้หญิงในภาพผู้หญิงคนนี้คือนางทะมนต์วันผ่านแผนอายุ36ปี
0-703-16.wav	กลัวก็เลยยืนนิ่งไม่ตอบโต้สุดท้ายก็แยกย้ายไปนะฝ่ายนายพิเศษ
0-705-3.wav	ซึ่งในส่วนของเพทราเนี่ยสอบปากคำในฐานะผู้ต้องหาฆาตกรรมนายฮันส์
0-706-21.wav	คนที่ก่อเหตุคือนายสมนึกจันโฉมอายุ40ปี
0-706-23.wav	คือนายธนจิตอายุ19ปีกับนายนบอายุ18ปี
0-706-27.wav	ซึ่งการจับกลุ่มนายสมนึกกับนายธนจิตจับกลุ่มได้เพราะว่าเขาหลบไปซ่อนตัวอยู่ที่ต่างจังหวัด
0-706-29.wav	นายธนจิตไปลำปางส่วนในน้มกลับไปที่นครสวรรค์
0-706-31.wav	นายสมนึกเขาบอกว่าเขาเป็นคนขับรถครับ
0-706-36.wav	จากนั้นตัวนายสมนึกเองก็เป็นคนลงมือใช้แก๊สตัดประตูนิรภัย
0-706-45.wav	หวังจะเอาไปใช้หนี้นะครับไปฟังเสียงของนายสมนึกหน่อยนะฮะ
8-8010-20.wav	จากการสอบสวนเบื้องต้นนางพยอมอายุ48ปีเป็นยาย
