filename	text
7-7557-1386.wav	กระผมนายพิเชษฐ์เชื้อเมืองพาน(พิเชษฐ์เชื้อเมืองพาน,พิเชษฐ์เชื้อเมืองพาน)<MARK>สมาชิกสภาพผู้แทนราษฎร
7-7557-1575.wav	ผบ.ตร.(ผบ.ตร,ผบ.ตร.)ว่าจะส่งตำรวจที่ผ่านทั้งหมด1319นาย
7-7557-202.wav	ก็บอกในธรรมนอง(ธรรมนอง,ทำนอง)เดียวกันว่าทำดีไม่มีผลแต่ถ้ามีนายมีเงินมีตัวท่านจะได้ทุกอย่างในระบบนี้
7-7557-214.wav	มีเนื้อหาขอสนับสนุนขอรับการแต่งตั้งนายตำรวจสาม(สาม,3)นายให้ได้ดำรงตำแหน่งต่าง(ต่าง,ต่างๆ)
7-7557-43.wav	ท่านประธานที่เคารพผมจุลพันธ์(จุลพันธ์,จุลพันธ์อมรวิวัฒน์)<MARK>เพื่อไทยจากจังหวัดเชียงใหม่
7-7557-708.wav	โยงไปถึงนายตำรวจข้างนอกไปเรื่อยไปเรื่อย(ไปเรื่อยไปเรื่อย,ไปเรื่อยๆ)ไล่ไปเรื่อย
7-7563-24.wav	ศบค.(ศบค,ศบค.)ก็แถลงข่าวสถานการณ์การระบาดของโรคไวรัสโควิด-19ในประเทศไทยพบว่ามีผู้ป่วยเพิ่ม34รายมากกว่าเมื่อวานนิดนึงเนาะเมื่อวาน26ว่ะ(ว่ะ,วะ)20เท่าไหร่28ยอดรวมก็2613รายกระจายใน68จังหวัดทั่วประเทศนะคะรักษาหายแล้ว1405รายและเสียชีวิตเพิ่ม1รายรวมทั้งหมดผู้เสียชีวิต
7-7563-26.wav	นี้อาจจะมีการเฉลยว่าทำไมถึงเพิ่งมาบอกวันนี้นะฮะทั้งนี้กลุ่มผู้ติดเชื้อลาย(ลาย,ราย)ใหม่34ลาย(ลาย,ราย)เนี่ยเป็นกลุ่มผู้ป่วยที่มีประวัติสัมผัสกับผู้ป่วยยืนยัน27ลาย(ลาย,ราย)คือยังเป็นการติดจากคนที่ป่วยแล้วเนี่ยสูงสุดคนไทยที่กลับจากต่างประเทศ2ลาย(ลาย,ราย)แล้วก็อยู่ในสถานชุมชน1รายอาชีพเสี่ยง1และเดินทางมาจากต่างประเทศคือจะ
7-7468-30.wav	แล้วก็จากการพูดคุยกับนายศรีอ่อน(ศรีอ่อน,อ่อนศรี)<MARK>
16-16026-177.wav	กระทำของนายจธีมันโหดเยี่ยมมากนะคะ
16-16026-194.wav	นายธนกรวงนางผู้สื่อข่าว
21-21866-32.wav	ข้าวโพดสายพันธุ์นี้ถูกพัฒนาโดยนายทวีศักดิ์ผู้หลำ
7-7468-9.wav	โดยนายอ่อนศรี<MARK>เจ้าของอู่ให้การว่าขณะเกิดเหตุ
16-16026-203.wav	แต่จู่นายจธีลุกขึ้นมาอีกรอบ
0-245-166.wav	เพราะว่าเมื่อวานนายกรัฐมนตรีพูดในรายการ
21-21868-19.wav	แม่ก็ร้องห่มร้องไห้นอกจากนั้นค่ะทางฝั่งภรรยาคือนางบุภาโตบังเคียนก็นอนหมดสติอยู่
7-7471-2.wav	หลังจากนายมีชัยมริชุพันธ์(มริชุพันธ์,ฤชุพันธุ์)<MARK>ประธานกรธ.(กรธ,กรธ.)มีการนำทีมออกไปแถลงให้กับสื่อมวลชน
21-21868-22.wav	เล่าให้ฟังว่าเหตุการณ์เนี้ยมันเกิดขึ้นต่อหน้าต่อตาคนที่ทำเนี่ยคือนายสายชนศรีกระสังค่ะ
16-16026-42.wav	ส่วนผู้ต้องหาที่ก่อเหตุชื่อนายจะทีนามสกุลนามีลู
16-16026-58.wav	ร้านนี้บอกว่าผู้เสียชีวิตคือนางสาวถวยกับคนก่อเหตุคือนายจาธีเนี่ย
16-16026-60.wav	แล้วอยู่ดีนายจาธีก็กระชากคอเสื้อฝ่ายหญิง
21-21868-23.wav	มีปากเสียงทะเลาะกันแล้วก็เอารางข้าวหมูเนี่ยทุ่มใส่หัวนายนนทการจนเสียชีวิตเลยนะคะ
21-21868-25.wav	ชื่อว่านางสาวกันนิกาก็เล่าให้ฟังบอกว่าตั้งแต่แม่มีสามีใหม่เนี่ยตัวลูกก็ไม่ได้ยุ่งด้วยเลย
21-21868-40.wav	ตำรวจสภ.นางรองนะคะก็แจ้งข้อหากับนายสายชน
21-21868-9.wav	เจอศพของนายนนทการสิริโภคาค่ะ
21-21001-17.wav	จำนวนนี้มีนายวุฒิพัฒน์จุลเมษอายุ40ปี
7-7000-10.wav	นายนิทัศน์กิรติสุธิสาธรณ์(นิทัศน์กิรติสุธิสาธรณ์,นิทัศน์กีรติสุทธิสาธร)หรือว่าจ๊อบ<MARK>ครับคุณผู้ชมฮะ
7-7454-2.wav	บตบางสมบูรณ์นายกอบต.นครนายก
7-7454-41.wav	ปัจจุบันเนี่ยไปเปิดโปรงทุจริตแพร่ริมน้ำของอดีตนายกอบต.บางสมบูรณ์เนี่ย
7-7451-46.wav	โดยเฉพาะในช่วงเทศกาลสงกรานต์แบบนี้เนื่องจากว่าตอนนี้คนเดินทางเข้าจังหวัดหนองคาย
7-7454-15.wav	หมายศาลเข้าควบคุมตัวนายประสบโชคนิ่มเรือง
7-7454-42.wav	ก็คือนายประสบโชคเนี่ยนะฮะต่อมาตำรวจอนุมัติหมายจับผู้ต้องหา3คน
21-21001-17.wav	จำนวนนี้มีนายวุฒิพัฒน์จุลเมษอายุ40ปี
21-21001-1.wav	จังหวัดสมุทรปราการร่วมกับปปศ
21-21001-9.wav	สรรบุญเจริญรองผู้บังคับการตำรวจภูธรจังหวัดครับ
21-21004-0.wav	ตำรวจนายนี้เมาเอารู้ได้ยังไงว่าเขาเมาเอาเดี๋ยวคุณผู้ชมดู
21-21004-12.wav	สพขวาวสินรินนะครับตำรวจนายนี้เนี่ยนะครับ
21-21005-11.wav	ใช้มีดรุมทำร้ายนายสมเกียจศรีจันทร์
21-21005-21.wav	นายอนัญชัยชายเดชครับทนายความครอบครัวผู้เสียชีวิตเปิดเผยว่า
21-21005-22.wav	นำครอบครัวนายสมเกียจเข้าร้องขอความเป็นธรรมต่อพลตำรวจเอกจากทิพย์ชายจินดา
21-21006-10.wav	คุณผู้ชมครับขณะทำพิธีนางสาวสันสนีร้องไห้ตลอดเวลาแบบนี้ครับ
21-21006-24.wav	จะนำร่างไปประกอบพิธีทางศาสนาที่วัดบางกลางจังหวัดนนทบุรีนะครับ
21-21006-8.wav	โดยครอบครัวเดินลุยน้ำนะครับไปทำพิธีจุดทูบนางสาวสันสนีเรียกให้น้องชายกลับบ้านบอก
21-21007-13.wav	นางสาวนุสราเขมกานนท์ผู้ที่คอยอุปการะเลี้ยงดูเจ้าดำบอกกับทีมข่าวว่า
21-21008-44.wav	ซึ่งครั้งนี้ถือว่าเป็นครั้งแรกที่ครูเดินทางมาร่วมงานศพ
21-21009-17.wav	เราไปสอบถามฮีโร่วันนี้นะคะนายทศธาสิมมาซึ่งเป็นเพื่อนบ้าน
21-21009-37.wav	ลวกหน้าแกอีกอ่ะล่าสุดนะคะนายทวีพิมพ์อุบล
21-21010-9.wav	หลังจากที่พบว่าคุณครูอาสาท่านนี้ไปทำงานอยู่ที่อำเภออมก่อยที่จังหวัดเชียงใหม่7ปี
21-21011-9.wav	เดินทางมาที่วัดเชตะวนารามที่ตำบลหนองปริงอำเภอเมืองจังหวัดกำแพงเพชรค่ะ
21-21012-21.wav	ซึ่งเป็นบริเวณคลองสำแหล่จังหวัดปทุมธานี
21-21013-16.wav	ในพื้นที่ตำบลหานโพอำเภอเขาชายสนจังหวัดพัทลุง
21-21014-20.wav	นายสุวพงศ์กิติพัฒนภิบูลเองก็เดินทางไป
21-21014-23.wav	นางสาวเฉลิมพลอยชายวงศาอายุ33ปี
21-21017-18.wav	ลมศักดิ์นะคะที่อำเภอศรีเทพจังหวัดเพชรบูรณ์ค่ะ
21-21017-20.wav	ชื่อว่านายทัศนัยอายุ39ปีเขาก็เล่าให้ฟังว่าขายกาแฟอยู่ดีดี
21-21017-26.wav	พุ่งตรงมาทำร้ายนายทัศนัยโดยไม่รู้สาเหตุตามที่เห็นในคลิปภาพ
21-21017-36.wav	เป็นฝ่ายปกครองเซ็นไปก่อนนายทัศนัยบอกผมเซ็นไปก่อน
21-21017-38.wav	หลังจากนั้นตัวนายทัศนัยผู้เสียหายก็ไปลงบันทึกประจำวันเอาไว้เป็นหลักฐานที่สภ.ศรีเทพนะคะ
21-21017-41.wav	ก็คือเมื่อ13มกราคมนายทัศนัยบอกว่าผมเลิกรากับผู้หญิงคนนึง
21-21018-8.wav	ซึ่งรับผิดชอบให้บริการน้ำปลาปลาในพื้นที่74จังหวัด
21-21019-14.wav	บ้านหลังนี้อยู่ริมถนนสายโพทองแสวงหาในอำเภอแสวงหาจังหวัดอ่างทองนะคะ
21-21019-17.wav	นายธานินโตงามปพแสวงหาเปิดเผยนะคะว่าเหตุนี้เกิดขึ้นเมื่อวันอาทิตย์ที่ผ่านมา
21-21021-48.wav	อบให้ผมมามาให้กับพี่น้องประชาชนที่จังหวัดอุบ
21-21022-18.wav	ได้ขับรถมาจากจังหวัดแพร่มากับนางสงกรานภรรยา
21-21022-6.wav	เข้าช่วยเหลือนางสงกรานวงเกตอายุ32ปี
21-21025-0.wav	มาดูเทคนิคของคนสวยกันหน่อยดีกว่านะคะสำหรับดาวิกาที่หุ่นดีหุ่นเพอร์เฟคขนาดเนี้ยนางก็กินขนมนมเนยเหมือนเราเรานี่แหละแต่ทำไมทำไมใหม่ถึงหุ่นดีวันดีคืนนะคะเธอบอกว่าช่วงนึงเนี่ยเวลาที่มันอยู่บ้านเนี่ยประกอบกับว่าตัวเองป่วยอยู่ใช่ไหมวันก่อนที่บ้านหมุนน้องก็บอกว่าน้องทานอาหารเพื่อบำ
21-21029-103.wav	เรามีหน้าที่จะต้องพิจารณาว่าการที่ท่านหัวหน้าพักเพื่อไทยได้เสนอชื่อนายพิธานั้น
21-21029-14.wav	เพื่อให้ความเห็นชอบบุคคลที่ดำรงตำแหน่งนายกรรมตรี
21-21029-45.wav	ได้เป็นผู้เสนอชื่อนายพิธาริมเจริญรัฐให้เป็นบุคคลที่สมควรเป็นนายกรรมตรี
21-21029-48.wav	การเสนอชื่อนายพิธาริมเจริญรัฐในครั้งนี้
21-21029-95.wav	สมาชิกภาพของสมาชิกสภาพผู้แทนราชดรก็คือของนายพิธาริมเจริญรัฐ
21-21029-99.wav	อันเป็นข้อเท็จจริงที่แสดงให้เห็นโดยปราศจากข้อสงสัยว่านายพิธาริมเจริญรัฐเป็นบุคคลที่
21-21035-13.wav	เพราะว่าถูกตำรวจวิสามันก็คือนายวัชระรัตนสุวรรณอายุ47ปี
21-21035-17.wav	ก็คือกลุ่มของนายจำรัฐรักจันทร์หรือว่าฉุยเขาจันทร์อายุ44ปี
21-21035-23.wav	แล้วก็มีนายอัธพลใหม่อ่อนหรือว่าในรวยอายุ21ปี
21-21035-38.wav	เพราะว่านายฉุยเป็นบุคคลอันตราย
21-21036-66.wav	ที่สภ.มาพตาพุธจังหวัดระยอง
21-21037-13.wav	นายเกียรติศักดิ์ถูกคนร้ายไม่ต่ำกว่า3คน
21-21037-37.wav	ด้านของภรรยาค่ะนางสาวกาญจนาอ่อนสา
21-21039-12.wav	เจ้าของเฟซบุ๊คชื่อว่านายตะสายฟินเนี่ย
21-21040-18.wav	พอได้สตินายสภาพก็รับสารภาพขโมยเงินยายแท้มาหนึ่งหมื่น
21-21043-32.wav	นายสุธิพงศ์รัตนกิจอายุ26ปีเป็นผู้เสียหายนะคะ
21-21043-44.wav	ตอนเกิดเหตุค่ะนายสุธิพงศ์บอกว่า
21-21043-49.wav	นายสุธิพงศ์บอกผมก็นั่งรอนะก็ไม่ได้คิดอะไร
21-21043-57.wav	ตัวนายสุธิพงศ์บอกว่าผมเปล่าผมไม่ได้ยก
21-21043-70.wav	นายสุธิพงศ์บอกว่าเสียใจมากนะ
21-21043-95.wav	เขาชื่อว่านายธนพลจันทบุตรอายุ39ปีเป็นชาวจังหวัดระยอง
16-16003-40.wav	ที่บ้านเลขที่133หมู่ที่13ตำบลเมืองอำเภอเมืองเลยจังหวัดเลย
7-7000-10.wav	นายนิทัศน์กิรติสุธิสาธรณ์หรือว่าจ๊อบครับคุณผู้ชมฮะ
21-21044-58.wav	ทัวร์นี้มาจากโรงเรียนในจังหวัดนราธิวาส
21-21047-29.wav	ก็จริงสวยจริงนะครับอันนี้ที่เกาะพังอันจังหวัดสุราษฎร์ธานี
21-21047-42.wav	ภายในมหาวิทยาลัยเทคโนโลยีสุระนารีที่จังหวัดนครราชสีมากันบ้านนะครับ
21-21048-43.wav	ผู้ช่วยป้องกันจังหวัดมหาสารคามชื่อว่านายพระมรันยูมายูนนะฮะ
21-21049-2.wav	นี่พาไปดูที่ตำบลองคารักษ์ที่ตำบลบางเจ้าฉ่าอำเภอโพทองจังหวัดอ่างทองค่ะ
21-21051-10.wav	และนางนุชชนาธิ์งามสุวิชากุลอายุ14ปีภรรยาผู้เป็นแม่เสียชีวิต
21-21051-11.wav	โดยในวันนี้นางสาวสุภาพิษงามสุวิชากุลหรือน้องพลอยอายุ16ปี
21-21051-12.wav	ลูกสาวคนโตพร้อมญาติญาติเดินทางมารับศพของทั้งคู่
21-21051-36.wav	ขณะที่นายสมชายเวโรธพิพัฒน์เสียเบ้นผู้ก่อเหตุ
21-21051-37.wav	เดินทางมาร่วมแสดงความเสียใจจากสิ่งที่เกิดขึ้น
21-21051-7.wav	จากเหตุการณ์ที่นายสมชายเวโรธพิพัฒน์อายุ57ปี
21-21052-35.wav	ยังบ้านเลขที่8ทับ9ที่ตำบลบางบุตรอำเภอบ้านค่ายจังหวัดระยอง
21-21053-38.wav	จากเหตุการณ์ที่เกิดขึ้นนายปราเมฆเหล็กเพชร
21-21056-13.wav	ด้านนายวิเชียนภวงทองผู้ใหญ่บ้านหมู่2ตำบลรางบัว
21-21056-2.wav	เหตุการณ์นี้เกิดขึ้นที่จังหวัดราชบุรีซึ่งแม้ว่าทางครอบครัวเนี่ยไม่ติดใจแต่ว่าตำรวจสภ.จอมบึงเตรียมแถลงผลตรวจสอบสภาพสดที่แน่ชัดในวันพฤหัสบดีนี้นะคะ
21-21056-4.wav	นายทิตินันผู้สุวรรณอายุ43ปีเจ้าของอู่รับทำเบาะรถยนต์
21-21057-0.wav	พลเอกประวิทย์วงสุวรรณก็ไปตรวจสถานการณ์น้ำด้วยที่จังหวัดปทุมธานีครับ
21-21060-212.wav	พี่ชายแท้ให้ขึ้นมาจากจังหวัดตรัง
21-21061-18.wav	นายพิชยาศรีธัญรัฐหรือออมอายุ30ปี
21-21064-22.wav	นี่ค่ะนางสาวอนุกูลวงบัวทอง
21-21065-49.wav	ผมชื่อนายธนกรนามสกุลธนเจริญรุ่งโลศชื่อเล่นเอกอายุ51ปีปัจจุบันผมเป็นพนักงานขับรถบริษัท
21-21066-18.wav	อย่างนายซาอิฟคูอาชิและนายเชอรีฟคูอาชิชาวมุสลิม
21-21066-57.wav	รวมถึงนายชาวสเตอร์โกอดีตประธานาธิบดีฝรั่งเศสผู้ล่วงลับ
21-21067-15.wav	พบศพนายพงพันธ์เนี่ยครับโอ้ย
21-21067-23.wav	ทะเบียนจังหวัดขอนแก่น
21-21068-28.wav	ตัวทางด้านของนายมนชัยเล่าแบบนี้
21-21070-35.wav	อุทยานแห่งชาติภูผายนตะบลน้องบ่ออำเภอนาแก่จังหวัดนครพนม
21-21070-37.wav	มันสวยงามมากจริงแล้วคุณจะได้มองเห็นวิวทิวทัศน์ของ3จังหวัด
21-21070-40.wav	ดูรายการเราก็ได้รู้จักสถานที่อันซีนท่องเที่ยวใหม่สวยอีกเยอะ
21-21071-13.wav	มาให้กำลังใจนางจุลาวันประจันตเซนเป็นภรรยาของคุณพรศักดิ์แล้วก็ลูก
21-21071-15.wav	ทางสภาวัฒนธรรมจังหวัดหนองบัวลําภูและรองนายกอบจหนองบัวลําภูพร้อมคณะค่ะ
21-21071-16.wav	ก็เดินทางนำพวงหลีดมาเคารพศพด้วยแล้วก็แสดงความเสียใจต่อครอบครัวผู้สูญเสีย
21-21071-24.wav	เมื่อวันที่2พฤศจิกายน2503ที่บ้านโนนสมบูรณ์อำเภอบ้านไผ่จังหวัดขอนแก่น
21-21071-8.wav	ศพของนายพรศักดิ์สองแสงหรือนายบุญเสาประจันตเซนลูกสาวและลูกชายเนี่ย
21-21074-18.wav	หรือเรื่องการค้ามนุษย์ชาวโลหิงญาที่เป็นการกลั่นแกล้งนายตำรวจน้ำดี
21-21074-485.wav	แต่ก็ยังปล่อยให้นายตำรวจคนนี้ใช้อำนาจสั่งการคนอื่น
21-21074-512.wav	โดยตำแหน่งผู้การกองบินตำรวจก็จะรับหน้าที่ผอการเดินทางถวายไปพร้อมกันด้วย
21-21074-542.wav	แล้วทำไมกันจึงต้องเป็นนายตำรวจคนนี้เท่านั้นที่จะมาเป็นผอศูนย์อะไรก็ไม่รู้นี้ได้
21-21074-585.wav	พอการเดินทางถวายมาเป็นตำแหน่งติดตัวของตัวเอง
21-21074-596.wav	เพื่อที่จะเป็นผอการเดินทางถวาย
21-21074-603.wav	ผู้ที่จะเป็นผอการเดินทางถวายในอากาศยานนั้น
21-21074-86.wav	และนอกจากตำรวจสองนายที่เสียชีวิตไป
21-21078-20.wav	ก็นำโดยนายวัญชัยศรีวงญาติดีในอำเภอวาปีปทุม
21-21078-38.wav	โดยกิจกรรมค่ะก็มีการพัฒนาวัดในจังหวัดต่างๆๆ
21-21080-136.wav	ด้านของนางสาวเพชรัตน์วงรัตนาการหลานสาวผู้โพสต์เรื่องนี้นะครับ
21-21080-29.wav	โดยนางสุรางวงรัตนการลูกสาวของอากงและอาม่า
