filename	text
21-21126-7.wav	ลอกเรียนแบบกับการเดินทางมาทำงานนะครับ
21-21127-36.wav	นางสาวงามตาโยธานันร้องไห้ด้วยแหละ
21-21128-0.wav	พาคุณผู้ชมไปที่เทศบาลเมืองระโนธจังหวัดสงขลากันหน่อยนะคะ
21-21128-74.wav	ันทพรธวระทีมข่าวไทยรัฐทีวีรายงานจากจังหวัดสงขลาค่ะ
21-21128-7.wav	ก็คือถนนเส้นราชบำรุงในเขตเทศบาลตำบลระโนธจังหวัดสงขลาค่ะ
21-21130-0.wav	หอนไก่ที่จังหวัดราชบุรีคุณดูดิ
21-21131-33.wav	นายอานนท์นำพาก็มีการอ่านประกาศ
21-21131-51.wav	เพื่อเดินทางไปที่รัฐสภาเกียรติกายนี่บรรยากาศสดนะฮะ
21-21131-55.wav	จะเดินทางไปถึงรัฐสภาเกียรติกานี่คือความเคลื่อนไหว24มิถุนาครับ
21-21133-12.wav	อยู่ที่ตำบลท่าม่วงอำเภอเทพาะจังหวัดสงขลาค่ะ
21-21133-1.wav	จังหวัดสงขลาคือคนร้ายเนี่ยมีการก่อเหตุปล้นรถกระบะมามาทำคาร์บอม
21-21133-22.wav	พบรถกระบะที่ใช้ทำคาร์บอมค่ะเป็นรถอีซูซูหมายเลขทะเบียนจังหวัดสงขลานะคะ
21-21133-3.wav	ก็คือต่อชดจนได้รับบาดเจ็บ2นาย
21-21133-50.wav	จะเป็นฝีมือของกลุ่มนายบูคอรีหลำโซะ
21-21133-52.wav	แก่นำแนวร่วมเคลื่อนไหวในพื้นที่4อำเภอชายแดนของจังหวัดสงขลา
21-21134-12.wav	ชิงแชมป์เอเชียที่จังหวัดนครราชสีมา
21-21136-87.wav	ผู้บังคับการตำรวจภูธรจังหวัดนราธิวาสก็บอกว่า
21-21136-94.wav	ซึ่งขณะนี้ยังติดต่อนายสมปองนกุลเจ้าของโกดังยังไม่ได้ครับ
21-21138-14.wav	แบงค์เป็นนุ่มนักแข่งรถชาวตำบลเขาต่ออำเภอปลายพระยาจังหวัดกระบี่
21-21145-25.wav	ขณะที่นายนัทพลทีพสุวรรณรองหัวหน้าพักพลังประชารัฐนะคะ
21-21145-30.wav	ส่วนนายสรอาจกินประทุมนะคะประธานพักภูมิใจไทย
21-21145-36.wav	มาดูรถแมพที่นายวิษณุเครืองามรองนายกรัฐมนตรีด้านกฎหมาย
21-21145-43.wav	และวันรับสมัครสอสอจำนวนสอสอแต่ละจังหวัดค่ะ
21-21147-1.wav	วันนี้นายเสรีสุวรรณภานนท์ค่ะได้พูดถึงกระแสข่าว
21-21147-8.wav	ว่าจะมีการเสนอชื่อนายพิธาหัวหน้าพักเก้าไกลชื่อเดียวหรือเปล่า
21-21152-130.wav	แต่ขนาดที่เรากำลังรายงานกันอยู่ก็ยังมีจังหวัดเพิ่มเติมขึ้นมา
21-21152-160.wav	ขอให้ทุกคนไม่ว่าจะอยู่เขตไหนจังหวัดไหนให้ระวังชาวพม่า
21-21152-249.wav	เดินทางมาจากสถานีรถไฟอำเภอกันธรารมจังหวัดศรีสะเกษ
21-21152-257.wav	มีแบบว่าเดินทางไปมาบนคลอง
21-21152-360.wav	กรณีที่นายสำริทมณีฤทธิ์อายุ38ปีค่ะก็อยู่ในอาการมึนเมา
21-21152-362.wav	สมุทรปราการที่กำลังเดินทางช่วยเหลือคนป่วยขั้นวิกฤต
21-21152-377.wav	ก็นำคลิปวิดีโอที่บันทึกพฤติกรรมของนายสำริท
21-21152-385.wav	ตามที่เสนอข่าวไปล่าสุดค่ะนางนันทินันบริบูรณภรรยาของผู้เสียชีวิต
21-21152-393.wav	ส่วนจะแจ้งข้อหาเพิ่มเติมกับนายสำริท
21-21152-397.wav	ส่วนนายสำริทในขณะนี้ยังถูกคุมขังอยู่ที่สภ.เมืองสมุทรปราการ
21-21152-410.wav	แล้วก็ยืนยันว่าจะแจ้งความดำเนินคดีกับนายสำริท
21-21152-561.wav	เราจะไม่นับจังหวัดเพราะว่ามันเพิ่มขึ้นมาเรื่อย
21-21152-85.wav	วันที่21ธันวาคม20เขายังขับรถไปส่งภรรยาเลือกตั้งนายกอบจอยู่เลย
21-21155-40.wav	เจ้าของโพสต์ก็คือนายสุวินเสือเจริญนะคะเขาเล่าให้ฟังนะคะ
21-21157-23.wav	ถูกค่ะทีนี้ตัวนายมาริแกนเองเขาก็เขียนเล่าลำดับเหตุการณ์นะคะเรื่องราวทั้งหมดนี้ผ่านทางบล็อกของเขาเมื่อวาน13เมษายน
21-21157-68.wav	นายประวิทย์ลี่สถาพรวงศากรรมการกิจการกระจายเสียงกิจการโทรทัศน์และกิจการโทรคมนาคมแห่งชาติหรือกศธชก็บอกว่า
21-21158-2.wav	นอกจากจะมาทำนายไทยทัก3ราศีดวงเฮงปีกระต่ายแล้วนะคะ
21-21159-7.wav	นักร้องหนุ่มหน้าตีบีทัศภาคและนางร้ายไซมินิกุ๊บกิ๊บสุมนทิพย์
21-21163-167.wav	เจมีนายภาษาอังกฤษนะครับคนคู่เนี่ยหมายความว่าคนราศีนี้มักจะต้องมีอะไรสองอย่างในเวลาเดียวกัน
21-21163-30.wav	ท้ายที่สุดทำให้เกิดน้ำท่วมในจังหวัดต่างๆๆเหล่านี้นะครับ
21-21163-35.wav	น้ำท่วมหมดเลยนะฮะในหลายอำเภอของแต่ละจังหวัดด้วยนะครับ
21-21163-37.wav	ทำให้หลายจังหวัดไม่ว่าจะเป็นเพชรชบุรีนะฮะชุมพรสุราษฎร์ธานีนครศรีธรรมราชแล้วก็สงขลานะครับ
21-21163-53.wav	ก็คือนายกรสิทธิราวพันธ์อายุ19ปีหรือว่าน้องพอร์สอาสาสมัครหน่วยสมเด็จเจ้าพระยานั่นเองนะครับ
21-21167-56.wav	หรือว่านางสาวสาราลีคลีล้วนแก่นำคนเสื้อแดงที่นครพนมนี่เจ๊ติ้งนะครับ
21-21167-73.wav	ทางป้านานะครับป้านานางวันธนาโอทองนะครับนี่ป้านานะครับ
21-21169-3.wav	ชื่อจริงคือนางสาวอายาภาอิสริยาฐากูลวัย28ปีหรือที่ใครหลายคนเรียกเธอว่าคุณนายดาวนะ
21-21169-55.wav	โดยเฉพาะนายสุพธกับแม่ของนายสุพศที่อยู่ในวันซื้อขายที่ดิน
21-21169-56.wav	นายสุพธเขายืนยันว่าที่ผ่านมาเขาเคยช่วยเหลือรัฐมาตลอด3ปี
21-21169-5.wav	กล่าวหาหรือว่าแจ้งความก็มีบอกว่าตัวเธอเนี่ยนางสาวอายภาหรือว่าคุณนายดาวเนี่ย
21-21169-87.wav	ได้รับความเสียหายนี่ฮะนี่นายชายศนี่ก็เป็นหนึ่งในพยานของคุณนายดาว
21-21169-93.wav	มีพฤติกรรมเดียวกับที่นายชายศถูกหลอกเลยของเธอเนี่ยเสียหายห้าหมื่นแจ้งความไว้แล้ว
21-21170-16.wav	ประชาชนต่างเดินทางไปเที่ยวชมความงดงามของพันไม้เมืองหนาวภายในอุทยานเป็นจำนวนมากค่ะ
21-21170-17.wav	นางสาวพิชยาการหน่อแก้วมูลฝ่ายประชาสัมพันธ์อุทยานหลวงราชพฤกษ์บอกนะคะว่า
21-21171-14.wav	แล้วก็ใช้ปืนกระบอกเดียวกันยิงนายอนุวัฒน์ใจดีอายุ57ปี
21-21171-27.wav	เมืองต้นทางด้านของนางประพาแล้วก็เป็นภรรยาของนายอนุวัฒน์คนเจ็บ
21-21171-46.wav	แต่ว่านายอนุวัฒน์พยายามมาตีสนิทพยายามเข้าหา
21-21176-17.wav	นำโดยนายไทยกรพลสุวรรณแล้วก็นายยศสวิทย์ชูกล่อมนะครับ
21-21176-1.wav	นายสิริชัยนาถึงหรือว่านิวพรมศรวิรธรรมจารีหรือว่าฟ้านะคะ
21-21178-2.wav	ตระเวนจะข่มขืนเด็กนักเรียนตามหอพักในพื้นที่อำเภอเมืองจังหวัดศรีสะเกษ
21-21180-5.wav	แซนวิสาพัฒน์ไปกับนายพรศักดิ์วิพาทอาพานนท์ทนายความ
21-21183-27.wav	ทางด้านนายสัตวแพทย์สรวิทย์
21-21183-7.wav	นายชัยพรศรีถันนะครับ
21-21184-9.wav	เรื่องต้นได้เล็งใช้สนามช้างอารีน่าจังหวัดบุรีรัมย์เป็นสังเวียนกลางนะครับ
21-21185-39.wav	เพราะว่าตอนนี้ที่ต้องพูดแบบนี้นะคะคุณผู้ชมค่ะเพราะตอนนี้หลายจังหวัดบุคลา
21-21189-83.wav	เนื่องจากเชื่อกันว่าเป็นรูที่พญานาคใช้เพื่อเดินทางจากใต้บดานมายังพื้นดิน
21-21190-14.wav	เข้าร้านอาหารเรือนแพรอำเภอสรรกำแพงจังหวัดเชียงใหม่
21-21195-13.wav	นายอาคมและนางประกายธรรมคำสองคนนี้คือพี่ผู้ชายคนนี้เป็นคนขับรถเมย์
21-21196-131.wav	เมื่อวานนี้เองก็มีคนเดินทางกลับจากต่างประเทศหมายถึงคนไทย
21-21196-133.wav	เมื่อวานนี้เกือบ200ค่ะกลุ่มแรกเป็นกลุ่มคนไทยเดินทางกลับจากอีราน
21-21196-134.wav	ส่วนอีกหนึ่งกลุ่มเป็นคณะพระทุดงแม่ชีและญาติธรรมที่เดินทางกลับจากอินเดีย
21-21196-138.wav	รวมทั้งหมด171คนเดินทางกลับจากเมืองเกากาต้าสาธารณรัฐอินเดีย
21-21196-153.wav	หลังจากนั้นก็รอคอยมาเรื่อยจนได้เดินทางกลับถึงประเทศไทย
21-21196-45.wav	หลัก12907รายเดินทางกลับบ้านได้แล้วนะคะ
21-21196-49.wav	คุณหมอทวีสินบอกว่าการที่พบผู้ป่วยในสถานกักขังที่จังหวัดสงขลาก็คือแรงงานต่างด้าว42รายเนี่ย
21-21199-15.wav	และมีคำสั่งให้นายเปรมศักดิยยุระนายกเทศมนตรีเมืองบ้านไผ่
21-21200-27.wav	นายสงการอัจฉริยศัพย์แล้วก็น้องก้อยคนที่ถูกกล่าวหานะคะ
21-21200-429.wav	นายสงการแน่ใจว่าตำรวจยังไม่ได้ได้พยานหลักฐานเพิ่มเติม
21-21204-21.wav	ซะทีเดียวนะคะนายยูเสี่ยวตรงเนี่ย
21-21204-24.wav	แต่หลังจากที่นางหวังเขาเริ่มมีอาการดีขึ้น