filename	text
7-7625-28.wav	หลังจากนั้นก็พาลูกสาวมาหานายปรัฐกร(ปรัฐกร,ประรัฐกร)<MARK>ซึ่งก็เป็นพ่อหรือว่าเป็นสามีเก่าของเธอนี่แหละ
7-7625-33.wav	เธอก็เลยเห็นหน้าว่าอ้าวนายปรัฐกร(ปรัฐกร,ประรัฐกร)<MARK>อดีตสามีนี่นะครับ
7-7625-35.wav	ทำให้นายพงศิษฐัศน(พงศิษฐัศน,พงศพัศ)<MARK>แฟนหนุ่มเธอเนี่ยได้รับบาดเจ็บส่วนหลานสาววัย11ขวบนั่งอยู่ข้างหลัง
7-7625-37.wav	เล่าให้ฟังบอกว่าแยกทางกับนายปรัฐกร(ปรัฐกร,ประรัฐกร)<MARK>มาเจ็ดปีแล้วซึ่งจริงจริงเนี่ย
7-7625-44.wav	โจก(โจก,โหนก)แก้มนี้แตกเลยนะคะครับนางสาวสาวิตรีคำสุข<MARK>
7-7625-55.wav	ส่วนทางด้านอาการของนายพงศิษทัศน์(พงศิษทัศน์,พงศพัศ)<MARK>นะคะอย่างที่บอกว่ามีพลเมืองดีนำตัวส่งโรงพยาบาลทัน
7-7625-69.wav	บอกว่าฝากดูแลภรรยาคือนางสาวธัญรัฐ<MARK>และลูกสาวให้หน่อยนะ
7-7625-72.wav	จนกระทั่งต่อมากลับมารู้ว่านายพงศุทัศน์(พงศุทัศน์,พงศพัศ)<MARK>เพื่อนที่ฝากฝังเนี่ย
7-7625-75.wav	ซึ่งนายปรัฐกร(ปรัฐกร,ประรัฐกร)<MARK>พ้นโทษออกมาแล้วเนี่ยเขาก็ไปมีคนรักใหม่เหมือนกัน
7-7625-93.wav	ไม่นานคิดว่าจะได้ตัวของนายปรัฐกร(ปรัฐกร,ประรัฐกร)<MARK>เร็วนี้ค่ะ
7-7627-0.wav	กันเลยที่จังหวัดตากกันบ้างดีกว่า
7-7628-184.wav	เป็นคนเลี้ยงหมูนะฮะนายเอกพลจันทะวง(จันทะวง,จันทะวงษ์)<MARK>โค้ชเอก
7-7631-0.wav	สำหรับใครที่อยากจะเดินทางไปต่างจังหวัด
7-7631-1.wav	และอยากจะเดินทางไปที่เขาช้างเผือกที่กาญจนบุรี
7-7633-20.wav	คนก่อเหตุชื่อว่านายพันธุ์<MARK>อายุ50ปี
7-7633-22.wav	เนื่องจากว่านายพันธุ์<MARK>คนก่อเหตุมีอาการป่วยทางจิตมานานหลายปี
7-7633-24.wav	อายุ48ปีชื่อว่านางอานนท์<MARK>
7-7633-27.wav	จากนั้นนายพันธุ์<MARK>ใช้ค้อนอันเดิมไปทุบศีรษะลูกชายคนเล็ก
7-7633-35.wav	หลังก่อเหตุเสร็จปุ๊บนายพันธุ์<MARK>วิ่งออกมา
7-7633-55.wav	เป็นของพี่สาวนายพันธุ์<MARK>ผู้ก่อเหตุ
7-7633-57.wav	แต่ต่อมาพี่สาวของนายพันธุ์<MARK>ตั้งครรภ์แล้วก็ตายทั้งกลมที่บ้านหลังนี้
7-7633-60.wav	พอเวลาผ่านไปค่ะที่ดินตรงนี้ก็เลยตกเป็นของนายพันธุ์<MARK>ผู้ก่อเหตุ
7-7633-72.wav	ก็คือนนายพันธุ์<MARK>มีเป็นผู้ป่วยจิตเวช
7-7633-75.wav	ชาวบ้านแล้วก็ญาติบางส่วนเชื่อว่านายพันธุ์<MARK>ไปสร้างบ้าน
7-7634-106.wav	คุณผู้ชมครับล่าสุดนางอังคณา<MARK>ภรรยาผู้เสียชีวิต
7-7634-10.wav	นายสมมาตรศรีชัยวาน(ศรีชัยวาน,ศรีชัยวัน)<MARK>อายุ47ปีเสียชีวิตลักษณะนอนหงายอยู่ในนาข้าวติดกับคันนา
7-7634-116.wav	สุดท้ายนายสมมาตร<MARK>สามีก็ยอมใจอ่อน
7-7634-14.wav	ห่างจากจุดเจอศพประมาณ100เมตรเป็นจุดเถียงนาที่นายสมมาตร<MARK>ใช้เป็นที่นอนเฝ้านาข้าวนะครับ
7-7634-17.wav	นี่ก็เป็นหลักฐานในที่เกิดเหตุนะครับเพื่อความชัดเจนตำรวจได้ส่งศพของนายสมมาตร<MARK>ไปชันสูตรอย่างละเอียดที่โรงพยาบาลศรีนครินทร์จังหวัดขอนแก่นนะครับ
7-7634-20.wav	เย็นวันที่15สิงหาคมนางอังคณา<MARK>บอกว่ามีปากเสียงกับ
7-7634-21.wav	นายสมมาตร<MARK>สามีอีกแต่คราวนี้ทะเลาะกันรุนแรงนะครับแรง
7-7634-22.wav	ทุกครั้งถึงขั้นลงไม้ลงมือกันหลังจากนั้นนายสมมาตร<MARK>
7-7634-42.wav	ญาติญาติของนายสมมาตร<MARK>เนี่ยเขาทักท้วงเอาไว้ค่ะเขา
7-7634-53.wav	ส่วนนายสมมาตรเอง<MARK>ญาติบอกว่าไม่เคยมีทีท่าว่าจะฆ่าตัวตาย
7-7634-58.wav	จุดที่เจอศพของนายสมมาตร<MARK>นะครับอยู่กลางทุ่งนาท้ายหมู่บ้านราษฎร์(ราช,ราษฎร์)ที่ตำบลหลักเมืองที่กาฬสินธุ์นะครับ
7-7634-59.wav	ได้คุยกับคนที่เจอศพคนแรกชื่อว่านายวิระ<MARK>ซึ่งพบว่ายังมีกระเป๋ารองเท้าแตะ
7-7634-60.wav	แล้วก็ข้าวของเครื่องใช้ต่างของนายสมมาตร<MARK>อยู่แถวเถียงนา
7-7634-61.wav	คุณภูริพัฒน(ภูริพัฒน,ภูริพัฒน์)บุญนิน(บุญนิน,บุญนิล)<MARK>ลงพื้นที่ไปเจอกับนายวิระ<MARK>ที่เจอศพคนแรก
7-7634-62.wav	จุดที่เจอศพนายสมมาตร<MARK>ห่างจากเถียงนาไม่ไกลนักนะครับ
7-7634-64.wav	ตรงนี้นะฮะนายวิระ<MARK>บอกว่าวันเกิดเหตุมีเพื่อนบ้านไปเห็นรถจักรยานยนต์อยู่ทางเข้าเถียงนา
7-7634-65.wav	ล้มอยู่แต่ไม่เห็นนายสมมาตร<MARK>เจ้าของรถก็เลยวานกันให้ช่วยตามหา
7-7634-68.wav	ด้วยความสงสัยก็เลยเดินตามไปดูเรื่อยก่อนจะไปเจอนายสมมาตร<MARK>นอนเสียชีวิตอยู่ในนาข้าว
7-7634-86.wav	คือนายสุนทร<MARK>มองว่ามันดูแล้วมีความผิดปกติอยู่หลายอย่าง
7-7634-90.wav	บ้านพักของพี่ชายของนางอังคณา<MARK>ภรรยาผู้เสียชีวิตนะคะ
7-7634-92.wav	ก็ได้ข้อมูลมาว่าน้องสาวกับนายสมมาตร<MARK>เนี่ยทะเลาะกันบ่อยค่ะ
7-7634-9.wav	บนหลักเมืองอำเภอกมลาไสยจังหวัดกาฬสินธุ์(ศรีสะเกษ,กาฬสินธุ์)ตรงเนี้ยนะฮะที่เป็นเถียงนาท้ายหมู่บ้าน
7-7635-26.wav	คุณผู้ชมคุณวรพร<MARK>มีชื่อลูกชายและลูกสาวของท่านนายกอบต.(อบต,อบต.)เป็นเจ้าของบริษัทด้วย
7-7636-36.wav	ซึ่งนายสอนชัยสุพิมาตร(สุพิมาตร,สุภิมาตย์)<MARK>นายกอบต.(อบต,อบต.)เมืองที
7-7636-70.wav	ก็ในการเดินทางอาจจะไม่ค่อยสะดวกเท่าไหร่
7-7638-27.wav	กล้องหน้ารถของคู่กรณีสามารถบันทึกภาพรถยนต์ของนายอุดมทรัพย์<MARK>ที่ขับปาดหน้า
7-7638-4.wav	ตำรวจภูธรภาค3เข้าจับกุมนายอุดมทรัพย์ล้อมแก้ว<MARK>หรือที่อ้างชื่อว่าเป็นสารวัตรโจ้<MARK>
7-7639-190.wav	นายอิโต(อิโต,อิโตะ)นะครับผู้ท้าชิงชาวญี่ปุ่น
7-7639-43.wav	นรงชัยมูลเวียงชัย(นรงชัยมูลเวียงชัย,ณรงค์ชัยมูลเวียงชัย)<MARK>อายุ20ปีเป็นชาวจังหวัดบุรีรัมย์
7-7643-38.wav	ผู้เสียชีวิต1รายคือนางสาวจิราพรนาคนิยม<MARK>อายุ27ปีส่วนนายกิติศักดิ์เกิดผลมาก<MARK>อายุ27ปีเท่ากัน
7-7643-40.wav	ไปสอบถามนางสาวสุกิตยา(สุกิตยา,สุกฤตา)นาคนิคม<MARK>ท่านนี้เป็นพี่สาวของผู้เสียชีวิตนะครับ
7-7643-42.wav	ก่อนเกิดเหตุนายกิติศักดิ์<MARK>จะไปส่งผู้เสียชีวิตทำงานที่โรงงานไมโครชิป
7-7644-0.wav	คุณดูสิทำใจดีทำใจดีเดี๋ยวจะพาไปงานนี้แล้วกันที่จังหวัดสุรินทร์นะ
7-7646-0.wav	นายสุภสิทธิ์(สุภสิทธิ์,ศุภศิษย์)กเจริญยศ(กเจริญยศ,กอเจริญยศ)<MARK>ผู้ว่าราชการจังหวัดกาฬสินธุ์เป็นประธาน
7-7646-1.wav	ในพิธีเปิดงานโครงการหอการค้าแฟร์จังหวัดกาฬสินธุ์ครั้งที่2ประจำปี2559
7-7646-3.wav	ด้านนายชัดชัย(ชัดชัย,ฉัตรชัย)วิรุธวรวุฒิ(วิรุธวรวุฒิ,วิรุฬห์วรวุฒิ)<MARK>ประธานหอการค้าจังหวัดกาฬสินธุ์เผยว่า
7-7647-0.wav	พรรคอนาคตใหม่นะคะได้สั่งห้ามนางสาวกวินาตาคี(กวินาตาคี,กวินนาถตาคีย์)<MARK>ส.ส.(สส,ส.ส.)ชลบุรี
7-7647-32.wav	ที่ปรากฏชื่อนางสาวกวินหน้าตาคี(กวินหน้าตาคี,กวินนาถตาคีย์)<MARK>
7-7647-47.wav	บอกว่ากรณีของนางสาวกวินนาฏ(กวินนาฏ,กวินนาถ)<MARK>
7-7647-55.wav	แต่เบื้องต้นสั่งห้ามนางสาวกวินาศ(กวินาศ,กวินนาถ)<MARK>
7-7647-79.wav	ส่วนรองโฆษกพรรคเพื่อไทยนางสาวสรัสนัน(สรัสนัน,สรัสนันท์)อันนบพร(อันนบพร,อรรณนพพร)<MARK>
7-7651-13.wav	ชื่อว่านายวิทูลย์(วิทูลย์,วิทูรย์)แสนวัง<MARK>หรือว่าแนน<MARK>อายุ23ปี
0-332-6.wav	นายวรบูลบุญยกค่ะเป็นหัวหน้าฝ่ายปกครองนะคะ
0-334-19.wav	นักศึกษาคนนี้ชื่อว่านายอัครพลศรีชาดาอายุ16ปีค่ะ
0-334-29.wav	แล้วก็ตะโกนเรียกนายอัครพลที่ตกลงไปได้ยินเสียงเพื่อน
0-334-35.wav	รุ่นพี่เองกับนายอัครพลแล้วก็เพื่อนอีกหลายคนเลยค่ะ
0-334-38.wav	รู้ว่าอ้าวนายอัครพลหายไปไม่รู้ว่าหายไปไหนก็เลยออกตามหา
0-337-16.wav	ฝนตกถนนลื่นนะคุณทัศนายไม่ต้องพูดถึงเลย
0-339-22.wav	แต่ว่าตัวของนายวรพลผู้ตายเนี่ยเขาไม่ได้มาที่นี่นานแล้ว
0-339-29.wav	นายวรพลข้อหาบุกรุกได้เลยกลัวว่าถ้าเข้าไปในห้อง
0-339-30.wav	จะไปทำลายข้าวของพังเสียหายหมดแต่นายวรพลไม่เชื่อนะฮะ
0-339-34.wav	ไม่ทันแล้วฮะเพราะว่าพอไปถึงนายวรพลลงไปแล้ว
0-339-38.wav	แล้วนายวรพลก็ตกกระแทกเสียชีวิตอยู่ข้างล่าง
0-339-9.wav	ตรงนี้ฮะนายวรพลดวงนำสว่างอายุ40ปีเป็นชาวสงขลา
7-7652-78.wav	นั่นก็คือคุณยายคำมั่นวงกาญจนรัฐ(วงกาญจนรัฐ,วงษ์กาญจนรัตน์)<MARK>รวมถึงยังมีหลานสาวของหลวงพ่อคูณ<MARK>ก็คือนางสงบวงศาโรธ(วงศาโรธ,วงศาโรจน์)<MARK>และนางสมบูรณ(สมบูรณ,สมบูรณ์)คุ้มประเสริฐ<MARK>ซึ่งเป็นบุตรสาวของคุณยายคำมั่น<MARK>นะครับ
7-7653-81.wav	ท่านบอกว่าท่านได้ถูกได้รับมอบหมายให้ดูคดีนายเติมเงินกู้(เติมเงินกู้,เติมเงินกู้)<MARK>
7-7655-18.wav	ขณะที่ผู้ผลิตสินค้าโอท็อป(โอท็อป,OTOP)ในจังหวัด
7-7656-10.wav	ซึ่งผู้ชายคนนี้แหละที่เอาปืนไปยิงอดีตภรรยาคือนางสาวแพนหม่อมธรรม<MARK>จนอดีตภรรยาได้รับบาดเจ็บ
7-7656-7.wav	นี่เลยค่ะคุณผู้ชมผู้ชายคนนี้คือนายมณัฐ(มณัฐ,มนัส)เครื่องงิ้ว<MARK>หรือว่านายแดง<MARK>
7-7658-41.wav	คณะจิตวิทยา(จิตวิทยา,จิตแพทย์)นะครับลองดูเพราะตำรวจบอกว่าทางนายฮารุ<MARK>เนี่ย
7-7658-42.wav	นายตีเพชร(ตีเพชร,ตรีเพชร)<MARK>ที่เป็นลูกน้องเขาเนี่ยใช้วิธีการก็คือ
7-7662-12.wav	พบร่างของนางสาวออนอุมา(ออนอุมา,อรุมา)สุรัตติศักดิ์<MARK>อายุ42ปี
7-7662-17.wav	ส่วนผู้ก่อเหตุทราบก็คือนายสมชายมิตรสาร<MARK>อายุ54ปี
7-7662-22.wav	เดินทางมาหานายสมชาย<MARK>ผู้ก่อเหตุ
7-7662-26.wav	แต่ทีนี้ครับนายสมชาย<MARK>ไม่ยอมให้กลับ
7-7662-28.wav	มีการยื้อแย่งปืนกันเพราะว่านายสมชาย<MARK>เอาปืนมาจ่อหัวฝ่ายหญิง
7-7662-29.wav	จนกระทั่งนายสมชาย<MARK>ยิงปืนยิงใส่หัวของผู้ตาย
7-7662-31.wav	หลังก่อเหตุนั้นนายสมชาย<MARK>ได้พาลูกสาวไปฝากไว้กับญาติที่อยู่ละแวกเดียวกัน
7-7662-39.wav	ผู้ตายก็จะพาลูกสาวเข้ามาเยี่ยมนายสมชาย<MARK>สัปดาห์ละ2ครั้ง
7-7662-40.wav	เพราะว่าเป็นลูกที่เกิดมาจากมาด้วยกันคุณระหว่างนายสมชาย<MARK>กับนางสาวออนอุมา(ออนอุมา,อรุมา)<MARK>
7-7662-41.wav	คือแม้ว่าทั้งคู่นะนายสมชาย<MARK>เองก็จะมีภรรยาอยู่แล้ว
7-7662-43.wav	นางสาวออนอุมา(ออนอุมา,อรุมา)<MARK>เนี่ยก็มีสามีอยู่แล้วแล้วก็มีลูกอยู่แล้ว
7-7662-44.wav	แต่ทีนี้นางสาวออนุมา(ออนุมา,อรุมา)กับนายสมชาย<MARK>ก็มามีลูกด้วยกันคือลูก9ขวบนะครับ
7-7662-45.wav	แล้วก็ตัวของนางสาวออนอุมา(ออนอุมา,อรุมา)ผู้ตายก็จะพาลูกมาเยี่ยมเยี่ยนเป็นครั้งเป็นคราว
7-7662-47.wav	เพราะว่าก่อนหน้านั้นนายสมชาย<MARK>คือจำคุกไง
7-7662-50.wav	แล้วก็นางสาวออนอุมา(ออนอุมา,อรุมา)<MARK>เนี่ยก็เหมือนว่าห่างกันไปเลิกรากันไปนะครับ
7-7663-20.wav	พอไม่มีการเดินทางยิ่งจังหวัดไหนเป็นจังหวัดที่ปกติอยู่ได้โดยการที่มีนักท่องเที่ยวไปเที่ยวเนี่ยค่ะ
7-7671-50.wav	เกือบ6000บาทให้กับนายสมพร<MARK>เนี่ย
7-7671-67.wav	ถ้ารู้อย่างนี้นะไม่ยื่นมือเข้าไปช่วยเหลือนายสมพร<MARK>ตั้งแต่แรก
7-7671-81.wav	ท่านผู้ชมครับในฝั่งของนายสมพร<MARK>นะฮะบอกกับเรานะครับบอกว่า
7-7672-10.wav	นั่นก็คือนายศักดา(ศักดา,ศักดา)หนกง(หนกง,หนูกง)หรือนายน้ำ<MARK>
7-7672-26.wav	ขณะที่นางสาวจงรักขุนพักดี(ขุนพักดี,ขุนภักดี)<MARK>ภรรยาผู้เสียชีวิต
7-7680-129.wav	นายสายัน(สายัน,สายันต์)<MARK>1ใน3คนที่ถูกออกหมายจับ
7-7680-145.wav	แต่ว่านายสายัน(สายัน,สายันต์)<MARK>ร่วมเดินทางมากับ
7-7680-135.wav	ตำรวจก็เลยนำตัวนายสายัน(สายัน,สายันต์)<MARK>ไปสอบสวนเพิ่มเติม
7-7680-139.wav	ตำรวจภูธรนาจอมเทียนจะนำตัวนายสายัน(สายัน,สายันต์)<MARK>
7-7680-219.wav	ส่วนศพของนายอนันตชัย<MARK>ตั้งอยู่ที่บ้านที่หมู่12
7-7680-222.wav	ดูทางครอบครัวของนางสาวปวีนา<MARK>ก่อน
7-7680-223.wav	นางวันเพ็ญนาเมืองรัก<MARK>ซึ่งเป็นแม่บอกว่า
7-7680-261.wav	นี่นางวันเพ็ญ<MARK>บอกว่า
7-7680-2.wav	เสียชีวิตนายอนันตชัย<MARK>หรือว่าฟอร์ส<MARK>
7-7680-3.wav	นางสาวปวีนา<MARK>หรือว่าสปาย<MARK>นะคะทั้งคู่อายุ20ปี
7-7680-432.wav	ส่วนน้องฟอสนายอนันตชัยจริตรำ(จริตรำ,จริตรัมย์)<MARK>อายุ20ปีนะครับ
7-7680-56.wav	หนึ่งในนั้นคือเสียอ้วนนะคะนายปัญญายิ่งดัง(ยิ่งดัง,ยิ่งดัง)<MARK>
7-7680-57.wav	คนที่2คือนายจิรษัก(จิรษัก,จิรศักดิ์)อุไนบัน(อุไนบัน,อุนัยบัน)<MARK>
7-7680-79.wav	จิรศักดิ์(จิรศักดิ์,จิรศักดิ์)<MARK>นายสายัน(สายัน,สายันต์)<MARK>ข้อหาก็คือเป็นลักษณะของการร่วมกันวางแผน
7-7680-85.wav	คนที่จับได้คือนายสายัน(สายัน,สายันต์)ศรีศุกร์(ศรีศุกร์,ศรีสุข)<MARK>นะคะ
7-7680-86.wav	คือนายสายัน(สายัน,สายันต์)<MARK>นี้เป็นลักษณะเหมือนกับคนชี้เป้าคุณภาคภูมิ<MARK>
7-7680-89.wav	พฤติกรรมของนายสายัน(สายัน,สายันต์)<MARK>เนี่ยเขาไปตีสนิทกับนายวราเทพมาสูงเนิน<MARK>
7-7680-91.wav	ก็ไปตีสนิทกับนายวราเทพ<MARK>
7-7680-95.wav	ตำรวจก็เลยบอกว่าเดี๋ยวจะต้องคุยกับนายวราเทพ<MARK>
7-7682-21.wav	นางสาวกระหนกออน(กระหนกออน,กนกอร)<MARK>เสียชีวิตเพราะว่าป่วย
7-7680-98.wav	ทีนี้ก็นายสายัน(สายัน,สายันต์)<MARK>เขาก็ให้ข้อมูล
7-7682-24.wav	ก็เลยส่งศพของนางสาวกระหนกออน(กระหนกออน,กนกอร)<MARK>ไปชันสูตรที่นิติเวช
7-7682-31.wav	สืบก็เลยไปเชิญตัวญาติของนางสาวกระหนกออน(กระหนกออน,กนกอร)<MARK>มาสอบอย่างละเอียด
7-7682-33.wav	หลานของคนตายคือนายวรวิทย์<MARK>อายุ19นะ
