filename	text
21-21370-0.wav	ให้คุณผู้ชมดูคลิปเหตุการณ์นี้นะคะมีคนเห็นเหตุการณ์แล้วก็ถ่ายภาพเอาไว้ได้เหตุการณ์ที่อำเภอท่าบ่อจังหวัดหนองคายผู้หญิงอายุสิบหกเท่านั้นนะคะถูกแฟนหนุ่มทำร้ายร่างกายคือจิกหัวกระชากแล้วทำร้ายร่างกายแบบ
21-21370-11.wav	ลูกสาวกับผู้ชายคนนี้เขากลับมาจากทำงานที่จังหวัดแพร่
21-21373-126.wav	จากนั้นอีก10นาทีนายอภิชาติเดินเข้ามาในร้าน
21-21373-133.wav	นายอภิชาติทำอะไรจนนายอภิชาติอาศัยช่วงที่เธอไม่ทันระวังตัว
21-21373-233.wav	นายอภิชาติบุญเรืองอายุ42ปี
21-21373-47.wav	เอาของเขาไปเนี่ยเขาร้องไห้แล้วก็เนี่ยเหมือนจะเข้าไปทำร้ายนายอภิชาติด้วยนะคะ
21-21373-74.wav	เป็นร้านขายอุปกรณ์การเกษตรจังหวัดปทุมธานี
21-21373-88.wav	ให้สามีก็คือนายอภิชาติย้อนกลับมาที่ร้าน
21-21376-0.wav	สำหรับเหตุการณ์เรือล่มในแม่น้ำป่าศักดิ์ช่วงที่ไหลผ่านจังหวัดเพชรบูรณ์
21-21376-9.wav	คือนายพิทยาไข่ทองอายุ17ปี
21-21377-25.wav	ลักษณะแบบนี้นะครับแล้วนายอุดมตัวสามีเนี่ยเชื่อว่าเมียน่าจะถูกงูกัด
21-21378-113.wav	สิ่งที่จะมาควบคู่กับประชาชนที่จะเดินทางมา
21-21378-296.wav	แล้วก็วันนี้ค่ะได้เห็นว่าประชาชนเดินทางมาเป็นจำนวนมาก
21-21378-297.wav	สัปดาห์หน้า1213ก็จะเดินทางมาเป็นจำนวนมากอีก
21-21378-2.wav	วันนี้จะมาให้ข้อมูลเพิ่มเติมเกี่ยวกับประชาชนที่จะเดินทางมา
21-21378-300.wav	ที่จะเดินทางมาบริเวณท้องสนามหลวงแล้วก็พระบรมมหาราชวังค่ะ
21-21378-69.wav	ผู้บัญชาการทหารบกมีแนวคิดที่จะทำโรงทานให้กับผู้ที่เดินทางมา
21-21378-80.wav	ประมาณสามพันคนหลายจังหวัดภาคอีสานก็จะมาพักเดินทางตั้งแต่ออกจากบ้านไม่มีค่าใช้จ่าย
21-21378-81.wav	อ่ามีรถรับส่งให้เรียบร้อยอย่างมุกดาหารเมื่อสักครู่ผมทราบว่ารองผู้ว่าการจังหวัดเขานำทีมมาเอง
21-21380-0.wav	คุณผู้ชมไปดูเรื่องราวนี้เกิดขึ้นที่จังหวัดอำนาจเจริญนะคะ
21-21380-15.wav	นายระพินแสนเริงอายุ49ปีหายตัวไปอย่างไร้ร่องรอย
21-21380-19.wav	เจอเพียงรถจักรยานยนต์ของนายระพินจอดไว้ข้างทาง
21-21380-27.wav	จากจังหวัดมหาสารคามมาที่อำนาจเจริญซึ่งเป็นพระอาจารย์
21-21380-28.wav	ที่เคยเป็นพระอาจารย์ของนายระพินตอนนั้นที่ไปบวช
21-21380-31.wav	นายระพินไปล่วงเกินเจ้าปู่ซึ่งดูแลปกป้องสถานที่แห่งนี้
21-21380-38.wav	และสุดท้ายจะยอมปล่อยตัวนายระพินกลับคืนมาอย่างปลอดภัยนะคะ
21-21380-40.wav	เป็นภรรยาของนายระพินเป็นผู้สูญหายบอกว่าหลังจากที่สามีหายตัวไป
21-21380-51.wav	ถ้าเกิดว่าพบเห็นนายระพินเมื่อสักครู่เราขึ้นรูปให้เห็นแบบชัดเจนแล้ว
21-21380-55.wav	เจ้าปู่จะปล่อยนายระพินผู้สูญหายกลับมาอย่างปลอดภัยนะคะ
21-21381-0.wav	เอาล่ะคุณผู้ชมมาดูที่อำเภอศรีมหาโพธิจังหวัดปลาจีนบุรีหน่อยนะคะ
21-21381-1.wav	ผู้ชายคนหนึ่งอายุ48ปีเขาเดินทางกลับมาจากพื้นที่เสี่ยงสูงสุด
21-21383-1.wav	เป็นการแข่งขันเรือยาวชิงถ้วยพระราชทานในจังหวัดชัยนาทนะคะ
21-21391-8.wav	ร้านนี้อยู่บริเวณถนนราชวงศ์อำเภอเมืองจังหวัดพะเยา
21-21392-118.wav	แล้วก็มีลมแรงในหลายจังหวัดครับ
21-21392-185.wav	รองผู้บังคับการตำรวจภูธรจังหวัดพังงานี่รองนะท่านรองมาเองเลยนะ
21-21392-201.wav	พาไปที่จังหวัดภูเก็ตเมืองท่องเที่ยว
21-21392-49.wav	เป็นชาวจังหวัดสตูลเกิดเมื่อปีพุทธศักราช2485เป็นที่รู้จักกันมาตั้งแต่ในตอนที่เล่นตลกกับ
21-21392-71.wav	โดยตอนนี้เนี่ยทางเขื่อนเจ้าพญาจังหวัดชัยนาทเขาก็อัปเดตข้อมูลในเรื่องของการปล่อยน้ำออกมาแล้วค่ะ
21-21392-74.wav	ระดับน้ำในเขื่อนเจ้าพระยาที่อำเภอสัพยาจังหวัดชัยนาทเนี่ยนะคะตอนนี้น้ำไหลลงสู่เขื่อนเจ้าพระยาผ่านจุดวัดน้ำค่ายจิรประวัติจังหวัดนครสวรรค์เพิ่มขึ้นต่อเนื่องนะคะ
21-21392-93.wav	แล้วก็ไปมอบถุงยังชีพให้กับพี่น้องประชาชนที่จังหวัดพระนครศรีอยุธยา
21-21393-8.wav	ในพื้นที่ตำบลดอนยางจังหวัดเพชรชบุรีนะคะ
21-21394-37.wav	อำเภอเมืองจังหวัดลพบุรีพร้อมกับรถคันนี้เลยค่ะ
21-21395-10.wav	แล้วก็เจ้าหน้าที่ฝ่ายปกครองอำเภอครองหลวงสัก50กว่านายครับ
21-21396-9.wav	ที่จังหวัดตราดสาวพาส่องเลขเด็ด
21-21397-0.wav	ไปดูอุบัติเหตุเกิดขึ้นที่จังหวัดนครนายกนะคะรถไฟชนกับรถกระบะ
21-21397-12.wav	ตำบลท่าเรืออำเภอปากพลีจังหวัดนครนายก
21-21397-6.wav	เป็นชาวจังหวัดศรีสะเกษได้รับบาดเจ็บสาหัสแขนหักลำตัวงอ
21-21397-8.wav	ชื่อว่านายธีรยุทธ์แก้วละมุนอายุ28ปีนะคะ
21-21398-34.wav	ตำรวจบอกว่านางสาวเรคนก่อเหตุเนี่ย
21-21398-36.wav	เพราะได้ยินนางสาวหนึ่งคนเจ็บไปพูดกับคนอื่น
21-21398-41.wav	เดี๋ยวเตรียมจะแจ้งข้อหากับนางสาวเรก็คือทำร้ายร่างกาย
21-21398-66.wav	บอกทีมข่าวไทยรัฐทีวีได้นะครับส่วนคนเจ็บนางสาวหนึ่ง
21-21398-6.wav	นี่เป็นจุดในครัวนะครับเป็นร้านอาหารแห่งหนึ่งในปั๊มน้ำมันที่จังหวัดพิษณุโลก
21-21405-16.wav	ผู้ตายก็คือนางลำไพรโควัฒนกุลอายุ41ปี
21-21408-17.wav	รองผู้บัญชาการตำรวจสอบสวนกลางบอกว่าคือเนื่องจากมีการแพร่ระบาดของกาแฟปลอมในหลายจังหวัดนะคะ
21-21408-6.wav	อำเภอลาดหลุมแก้วจังหวัดปทุมธานี
21-21409-18.wav	เขาก็เดินทางมาเปิดใจกับบันเทิงไทยรัฐนะเกี่ยวกับเรื่องราวความรักของทั้งคู่ด้วย
21-21410-25.wav	นายชายนายชายในนามสมมุตินะ
21-21410-33.wav	โดยนายสุริยาหางคิ้วแตก
21-21410-19.wav	ก็สอบถามนายสุริยาอยู่บำรุงอายุ25ปี
21-21410-36.wav	บอกว่านายชายคนขับรถกระบะส่งของ
21-21410-50.wav	นายสุริยาบอกว่าหากเป็นอยู่แบบนี้คุณ
21-21411-105.wav	ก็เลยคิดว่าเป็นเรื่องนี้นายบอยอ้างแบบนี้นะคะ
21-21411-10.wav	นายธวัชชัยงอกคำอายุ26ปีหรือนายบอย
21-21411-11.wav	2คนนี้เป็นผู้ต้องหาก่อเหตุข่มขืนเด็กหญิงอายุ14ปีในจังหวัดชัยภูมิ
21-21411-131.wav	ทีมข่าวของเราก็เลยไปที่บ้านพักเด็กและครอบครัวจังหวัดชัยภูมินะคะ
21-21411-132.wav	ไปคุยกับนางสาวสุชีวาบุญกอง
21-21411-133.wav	เจ้าหน้าที่บ้านพักเด็กและครอบครัวจังหวัดชัยภูมิ
21-21411-7.wav	เหตุการณ์นี้เกิดขึ้นที่จังหวัดชัยภูมิแต่พอทั้งสองคนไปมอบตัวเขาบอกว่าเขาไม่ได้ข่มขืน
21-21419-23.wav	คนตายน่าจะชื่อนางสาวกุ๊กกิ๊กอายุ22ปี
21-21419-28.wav	พร้อมกับล็อกกุญแจไว้ทำให้นางสาวกุ๊กกิ๊กขาดอากาศหายใจ
21-21419-31.wav	สิ่งที่นายเฉลิมชนให้การกับตำรวจขัดแย้งกับนายไอซ์โดยบอกว่า
21-21419-42.wav	จากคดีนี้นายไอซ์ต้องติดคุก
21-21419-50.wav	แต่หลังจากพ้นโทษนายเฉลิมชัย
21-21419-73.wav	ก็คือนางสาวกุ๊กกิ๊ก
21-21419-8.wav	ชายคนนี้คือนายอภิชัยหรือไอซ์องค์วิสิต
21-21420-15.wav	ภรรยาของคนเจ็บนะฮะคือนางดอกแก้วนะครับบอกถึงปมเหตุว่าทั้งสองคนคือบุญชมสามีของเธอกับเกษมหลานของเธอ
21-21420-28.wav	หลานสาวของคนเจ็บนะฮะหลานสาวของนายบุญชมเนี่ยบอกว่าไอ้ที่ดินปัญหาเนี่ย
21-21420-30.wav	คือก่อนหน้านี้รุนแรงถึงขั้นที่นายเกษมผู้ก่อเหตุเนี่ย
21-21420-31.wav	เคยเอามีดเนี่ยฟันนายบุญชมจนนิ้วเกือบขาดมาแล้ว
21-21420-35.wav	เพราะกลัวว่านายเกษมจะย้อนมาก่อเหตุฆ่าคนในครอบครัวคนเจ็บ
21-21420-37.wav	อาการของนายบุญชมตอนนี้หมอบอกว่าพ้นขีดอันตรายแล้ว
21-21420-5.wav	มีจักรยานยนต์ของนายบุญชมเนี่ยล้มคว่ำอยู่ด้วยนะครับก็ถูกนำตัวส่งโรงพยาบาล
21-21420-6.wav	จากการสอบสวนทราบว่าก่อนเกิดเหตุนายบุญชมคนเจ็บขี่จักรยานยนต์จะไปเก็บเงินนะฮะ
21-21420-7.wav	เป็นเงินออมวันละบาทที่ชุมชนบัวขาวระหว่างทางเนี่ยไปเจอกับนายเกษมภารีนนท์
21-21421-25.wav	เช้าที่ผ่านมามือยิงครับคือนายตั้มหรือว่านายวิเศษ
21-21422-17.wav	ซึ่งก็เรียกตัวนายสามารถเจ้าของร้านที่เกิดเหตุมาสอบปากคำอีกรอบนึง
21-21424-11.wav	ผู้บังคับการตำรวจภูธรจังหวัดอุดรธานีนำรถจักรยานยนต์คันนี้
21-21424-23.wav	แล้วก็เอาเอกสารใต้เบาะอ้าวไปพบชื่อของนายนคร
21-21424-31.wav	อยากจะขอบคุณตำรวจทุกนายที่ใส่ใจดูแลและนำรถมาคืนให้ถึงบ้าน
21-21425-125.wav	ช่วงนี้นางยุ่งอยู่นางถ่ายละครอยู่
21-21425-246.wav	เขาก็เดินทางไปแจ้งความว่ากาโตะไปพูดแบบนี้ต่าง
21-21425-470.wav	หน้าวัดแห่งหนึ่งที่จังหวัดพิษณุโลกครับ
21-21425-688.wav	พร้อมกับนั่งจับกลุ่มคุยกันนะครับถึงการตายของนายวิชาณว่า
21-21425-689.wav	หลังจากนายวิชาญผูกคอตายไปแล้วเพียงข้ามคืนเดียวเนี่ย
21-21426-7.wav	นายนิพนธ์บุญยามณีนายกองค์การบริหารส่วนจังหวัดสงขลาค่ะ
21-21429-16.wav	ผมยืนยันนะครับวันนี้ก็เริ่มดำเนินการเปิดไปแล้วที่ภูเก็ตแซนบล็อกแล้วก็จะมีการขยายไปยังจังหวัดต่างโดยรอบ
21-21429-289.wav	ผมพูดไปแล้วนะครับ3ประเทศแม้ว่ารายได้ของท่องเที่ยวจากของประเทศไทยในปี63
21-21431-26.wav	ยืนยันว่าจะอยู่เคียงข้างนายพิธาเพื่อรักษาประชาธิปไตยที่มาจากประชาชน
21-21431-34.wav	แต่เมื่อได้ฟังเหตุผลของนายพิธาแล้วก็เห็นด้วยในการแก้ไข
21-21431-36.wav	มาเป็นเงื่อนไขในการโหวตไม่เห็นชอบให้นายพิธาเป็นนายก
21-21434-120.wav	อำเภอเดียวครับในจังหวัดขอนแก่นหน้าถัดไปครับ
21-21437-0.wav	เรามาดูเหตุสลดที่เกิดขึ้นที่จังหวัดสุรินทร์กันก่อน
21-21437-35.wav	ขณะที่นางสาวจีราพรโสรจันทร์อายุ20ปีภรรยาผู้ตาย
21-21437-37.wav	หลังจากที่เดินทางมาจากบ้านพ่อของตัวเองเพื่อมาดูลูกแต่เช้า
21-21437-73.wav	ให้กับนางสาวจีราพรผู้เป็นแม่
21-21437-75.wav	ส่วนศพของนายสมชายได้ตั้งบำเพ็ญกุศลไว้
21-21437-77.wav	โดยมีชาวบ้านทยอยเดินทางมาร่วมงานศพ
21-21438-7.wav	บอกว่าหลังจากที่ไปสั่งสมประสบการณ์จากการเดินทางไปใช้ชีวิตในหลายประเทศทั่วโลก
21-21440-1.wav	แม่บ้านโฮมสเตย์แห่งหนึ่งในจังหวัดจันทบุรี
21-21440-57.wav	ตอนนี้ยังติดธุระและจะเดินทางมาให้ปากคำกับตำรวจภายในวันนี้
21-21441-12.wav	โดยนางสาวเอเด็กหญิงอายุ15ปี
21-21441-31.wav	ส่วนยายของน้องคนนี้ก็คือนางลีอายุ63ปีนะฮะ
21-21441-59.wav	ก็คือมีการนำตัวของนายอนุพงศ์จันทศรี
21-21445-0.wav	ส่วนช่วงนี้มาดูเหตุการณ์ความไม่สงบในพื้นที่จังหวัดภาคใต้กันหน่อยนะคะ
21-21445-13.wav	ในพื้นที่จังหวัดยะลาตำรวจภูธรกาบัง
21-21445-28.wav	ส่งผลให้เจ้าหน้าที่ได้รับบาดเจ็บสาหัส2นาย
21-21445-3.wav	ในพื้นที่จังหวัดยะลาปัตตานีและสงขลา
21-21447-17.wav	พอช่วงที่เข้าเขตจังหวัดกำแพงเพชรรถทัวร์ได้จอดแวะรับประทานอาหารนะคะ
21-21450-30.wav	คือนายสุวัสดิ์อายุ39ปีเล่าให้ฟัง
21-21456-29.wav	ถึงกรณีที่มีการนำปฏิทินของนางสาวยิ่งลักษณ์แล้วก็นายทักษิณนะคะ
21-21456-35.wav	ซึ่งนายดอนบอกว่าส่วนตัวไม่เห็นด้วยค่ะ
21-21459-28.wav	นายเจยี่หนึ่งในผู้ต้องหาเล่าให้ฟังแบบนี้นะคะ
21-21459-29.wav	วันเกิดเหตุเนี่ยตั้งวงกินเหล้ากันอยู่กับนายอาชิงนายซานตี้กินเหล้ากัน3คน
21-21459-42.wav	ทางครอบครัวของผู้ตายก็ติดต่อรับศพนายเฉินยี่ไห่อายุ51ปีคนนี้ค่ะ
21-21459-51.wav	ภรรยาของในเฉินนางวิไลพรเล่าทั้งน้ำตาเลยค่ะ
21-21460-20.wav	บอกว่าวันนี้ได้เดินทางไปที่สน.สถานีตำรวจภูธร
21-21462-16.wav	ช่วงนี้นะคะก็มีนักท่องเที่ยวเดินทางมาชมความงามกันเยอะมาก
21-21462-44.wav	แพะเมืองผีที่จังหวัดแพร่
21-21466-60.wav	คือนายจิตชัยเนี่ยเขาบอกกับเรานะครับบอกว่าปกติเนี่ยเป็นคนที่มีลักษณะนิสัยชอบกินของดิบอยู่แล้ว
21-21466-97.wav	อ้าวนี่ฮะนายจิตชัยหรือว่าหยกลูกหยี
21-21469-16.wav	และบางส่วนก็นำไปจำนำที่จังหวัดพระนครศรีอยุธยาและปทุมธานี
21-21469-20.wav	เชิญตัวนางแมลงนางสาวเชอรี่และเพื่อนคนงานที่บันทึกภาพในวันเกิดเหตุไป
21-21469-24.wav	ทำให้นางแมลงกลัวจึงสารภาพเรื่องทั้งหมด
21-21469-26.wav	นางสาวเชอรี่ฟังแล้วรู้สึกเสียใจ
21-21469-37.wav	ขณะที่เพื่อนบ้านของนางสาวเชอรี่
21-21471-110.wav	ห้ามออกนอกเคหสถานมีจังหวัดอะไรบ้างคุณ
21-21471-124.wav	อันนี้เป็นคำสั่งการขอความร่วมมือของแต่ละจังหวัด
21-21471-128.wav	แต่เชื่อว่าเดี๋ยวหลังจากนี้นะนอกจาก5จังหวัดนี้
21-21471-130.wav	ส่วนรายละเอียดของคำสั่งของแต่ละจังหวัดที่น่าสนใจอีกเรื่องหนึ่ง
21-21471-56.wav	ส่วนใหญ่ก็จะกระจุกตัวอยู่ในพื้นที่6จังหวัดนะครับ
21-21471-57.wav	ซึ่ง6จังหวัดนี้มีผู้ป่วยเป็นจำนวนมากนะครับ
21-21471-71.wav	ดังนั้นใน6จังหวัดที่พบการแพร่ระบาดมาก
21-21471-77.wav	มีจังหวัดไหนบ้างใน6จังหวัดนี้
21-21471-86.wav	ดังนั้นเดี๋ยวเราบอกขอบอก16จังหวัดของพื้นที่สีส้มแล้วกันค่ะคุณผู้ชม
21-21471-88.wav	6จังหวัดมีแพร่พะเยานครพนมตราดสิงห์บุรีอ่างทองชัยนาท
21-21471-95.wav	ตรงนี้จะเป็นกลุ่มจังหวัดที่เยอะที่สุดในประเทศ
21-21471-96.wav	ก็คือ55จังหวัดที่เหลือนั่นเอง
21-21477-116.wav	ในจังหวัดขอนแก่นนั่นเองนะฮะตอนนี้หลายพื้นที่หลายหน่วยงานก็เริ่มมีการให้คนนั้นไปฉีด
21-21477-34.wav	กลุ่มดังกล่าวเขาก็เดินทางถือป้ายประท้วงไปที่
