filename	text
21-21477-70.wav	ก็เดินทางมาตรวจเยี่ยมให้กำลังใจ
21-21477-9.wav	เขาเดินหน้าเดินทางไปที่กระทรวงศึกษาธิการ
21-21478-0.wav	ไปดูเหตุระทึกข้ามจังหวัดค่ะที่บอกว่าข้ามจังหวัดเนี่ยเป็นเหตุการณ์โชเฟอร์ขับรถบรรทุก6ล้อส่งน้ำแข็ง
21-21478-20.wav	สุดท้ายก็จนมุมบริเวณรอยต่อระหว่างจังหวัดเพชรชบูรณ์แล้วก็ลพบุรีนะคะ
21-21478-38.wav	ไปส่งพนักงานโรงพักวิเชียนบุรีจังหวัดเพชรชบูรณ์
21-21478-3.wav	ข้ามไปไกล3จังหวัดแบบนี้
21-21480-65.wav	ครอบครัวก็ได้เดินทางไปที่ปากน้ำนะคะ
21-21480-66.wav	จังหวัดสุปราการเพราะว่าเป็นสถานที่ที่อาต้อยเคยบอกไว้
21-21481-20.wav	ซึ่งเจ้าหน้าที่ก็จัดกำลังตำรวจกว่า430นายในการเดินตรวจตราโดยรอบอย่างเต็มที่
21-21481-36.wav	ฝ่ายตำรวจท่องเที่ยวเองเขาก็มีการจัดศูนย์ช่วยเหลือนักท่องเที่ยวต่างชาติ
21-21486-23.wav	แต่ว่าจะได้รับผลกระทบมากหน่อยก็คือบริเวณจังหวัดชลบุรีระยองจันทบุรีแล้วก็ตราดนะคะ
21-21487-22.wav	แฟนของเธอทำงานที่โรงพยาบาลแห่งหนึ่งในจังหวัดปทุมธานี
21-21488-21.wav	นายอดุลศักดิ์เล่าเหตุการณ์ชอกช้ำใจ
21-21488-13.wav	คือเจ้าของรถคือนายอดุลศักดิ์อายุ35ปี
21-21488-85.wav	แจ้งข้อหาดำเนินคดีกับนายอดุลคนนี้นะฮะตามกฎหมายต่อไป
21-21489-25.wav	แล้วช่วงนั้นนะครับนายประเสริฐ
21-21489-31.wav	นายประเสริฐเขาก็กลัวมีปืนด้วย
21-21489-77.wav	อีกฉบับหนึ่งก็เป็นการแบ่งที่ดินที่จังหวัดพิจิตร
21-21490-0.wav	ทีนี้พาไปที่จังหวัดชลบุรีหน่อยนะคะแหม
21-21491-12.wav	ไปพูดคุยกับนายเสงี่ยมวงชัยนะคะ
21-21496-12.wav	โดยมีญาติของกัปตันเรือเดินทางไปดูศพ
21-21499-4.wav	ที่ตำบลชุมโคอำเภอประทิวจังหวัดชุมพรนะครับไปดูเลย
21-21500-2.wav	เพราะฉะนั้นเราไปปักหมุดกันที่จังหวัดชลบุรีกันค่ะ
21-21501-2.wav	หลายคนวันนี้ไม่ได้ทำงานแล้วใช่ไหมไปเที่ยวท่องเที่ยวกันที่ไหนกันบ้าง
21-21503-24.wav	แล้วก็คนเดินทางถนนเนี่ยเขาจะได้มีความรู้สึกปลอดภัย
21-21504-23.wav	ทางนี้ทางจังหวัดยังคงเฝ้าระวังตามจุดเสี่ยงตลอด24ชั่วโมงต่อไปนะครับ
21-21504-28.wav	และพื้นที่จังหวัดพิษณุโลกได้หยุดตกแล้ว
21-21504-29.wav	ส่งผลให้ระดับน้ำในลำน้ำต่างที่ไหลผ่านจังหวัดพิษณุโลกลดลงเช่นกันครับ