filename	text
21-21217-49.wav	มุมแดงครับซ้อมอยู่ค่ายมวยดวงใจพ่อที่จังหวัดสุรินทร์นะครับ
21-21219-10.wav	เป็นทหารพรานในพื้นที่3จังหวัดชายแดนภาคใต้แล้วก็เป็นลูกพี่ลูกน้องกัน
21-21222-11.wav	เป็นผลไม้อัตลักษณ์ของจังหวัดพังงาค่ะ
21-21222-19.wav	แล้วก็ถือว่าได้รับความนิยมอย่างมากในจังหวัดพังงารวมถึงในประเทศไทยเรียกว่าเป็นหนึ่งเดียวก็ว่าได้
21-21224-0.wav	อีกหนึ่งที่นะครับพาไปหน่อยที่จังหวัดบึงกาฬ
21-21230-106.wav	แล้วก็นำตัวไปฝากขังต่อสารจังหวัดปทุมธานีในวันพรุ่งนี้นะครับ
21-21230-39.wav	เป็นการพูดจาที่ไม่รู้เรื่องของนายเต้ย
21-21230-46.wav	เรียงเรื่องราวได้ทั้งหมดว่านายเต้ยก่อเหตุทั้งสองเหตุ
21-21234-6.wav	บอกว่าในคืนวันนั้นที่ผับดังในเมืองพัทยาจังหวัดชลบุรี
21-21237-1.wav	เหตุการณ์เกิดขึ้นที่จังหวัดประจวบคีรีขันธ์คุณพ่อเนี่ยพาลูกทั้งหมด4คน
21-21237-9.wav	ตำบลช้างแรกอำเภอบางสะพานน้อยจังหวัดประจวบคีรีขันธ์
21-21238-34.wav	จะถูกชุดสืบสวนตำรวจภูธรจังหวัดสระแก้วตามรวบตัวได้
21-21238-36.wav	ผู้บังคับการตำรวจภูธรจังหวัดชลบุรี
21-21242-22.wav	บังคับการตำรวจภูธรจังหวัดสุราษฎร์ธานีก็บอกว่า
21-21242-48.wav	ผู้บังคับการตำรวจภูธรจังหวัดสุราษฎร์ธานีบอกว่า
21-21247-83.wav	เป็นภาพประวัติศาสตร์อีกทีนึงเดินทางไปพูดคุยทำความเข้าใจ
21-21253-60.wav	ที่จังหวัดอำนาจเจริญค่ะ
21-21253-61.wav	ก็คือไปจังหวัดที่ไปเก็บตัวนั่นแหละ
21-21253-67.wav	อันนี้เขานางเมื่อกี้เขานางสาวไทย
21-21254-9.wav	บ้านหนองตะกูอำเภอแปลงยาวจังหวัดฉะเชิงเทราครับ
21-21256-11.wav	เดินทางไปที่นิติเวชโรงพยาบาลธรรมศาสตร์เฉลิมพระเกียรติจังหวัดปทุมธานี
21-21256-27.wav	อำเภอคลองหาดจังหวัดสระแก้ว
21-21256-29.wav	ไปคุยกับนางนอมคุณแม่ของผู้เสียชีวิตนะคะ
21-21256-55.wav	ฐานก่อเหตุทำร้ายร่างกายโดยใช้อาวุธมีดฟันเข้าที่บริเวณศีรษะหน้าอกและกลางหลังของนายปรีชามุ่งเงิน
21-21258-24.wav	เขาขับรถมามาที่โรงพักนี้เนี่ยนะปรากฏว่าตัวนายจีรศักดิ์เนี่ย
21-21258-27.wav	ค่ะนายจีรศักดิ์ซึ่งจริงจริงก็อยู่บ้านของเขาแหละเสพกัญชาไง
21-21261-25.wav	เดินทางจากสถานีหาดใหญ่เข้ากรุงเทพนะครับ
21-21262-97.wav	ทุกครั้งที่เดินทางไปที่บ้านใบเตย
21-21263-10.wav	จากกรณีที่เรืออินแปลงของอำเภอกรรมราศัยจังหวัดกาฬสินธุ์
21-21263-13.wav	บริเวณวัดท่าตูมวารินตำบลท่าตูมอำเภอเมืองจังหวัดมหาสารคาม
21-21263-24.wav	กู้ภัยเมตตาธรรมจังหวัดกาฬสินธุ์
21-21267-48.wav	และกลุ่มผู้สื่อข่าวของไทยที่เดินทางไปติดตาม
21-21270-28.wav	เรื่องที่1จังหวัดอุบลราชธานี
21-21270-80.wav	เพราะว่ายายอะไรก็พอจะรู้มั่งในจังหวัดอุบล
21-21270-92.wav	ยายพยายามนึกถึงจังหวัดอุบลราชธานีให้ดีนะ
21-21270-94.wav	จังหวัดอุบลราชธานีมีกี่อำเภอ
21-21272-1.wav	โดยระบุว่านางสาวสุภาพรเป็นนักเรียนทุนพระราชทานและยอมสละสิทธิ์ไม่ร่วมประกวดในชุดว่ายน้ำเพื่อแสดงความอาลัย
21-21274-0.wav	สัปดาห์นี้ใครที่จะวางแผนเดินทางทำกิจกรรมกลางแจ้งสภาพอากาศเป็นอย่างไร
21-21275-27.wav	เป็นเจ้าของร้านเสริมสวยในอำเภอทุ่งใหญ่จังหวัดนครศรีธรรมราช
21-21275-28.wav	ตำรวจได้รับแจ้งเหตุก็เข้าไปตรวจสอบนางสาวยาเนี่ยยืนร้องไห้อยู่ในบ้านเนี่ยนะคะ
21-21280-104.wav	ซึ่งเรื่องนี้เนี่ยนะคะหลังจากที่เมื่อวานนายอัจฉริยะได้มีการแหมทุบโต๊ะปะทะคารมกันกับผู้บริหารโรงพยาบาลแล้วเนี่ย
21-21280-105.wav	ก็ได้เดินทางไปร้องที่กระทรวงสาธารณสุขด้วยนะคะ
21-21281-17.wav	กลางดึกถึงจังหวัดนครราชสีมาเลยทีเดียวค่ะ
21-21282-57.wav	ก็เดินทางมาที่เกิดเหตุแล้วบอกกับทีมข่าวแบบนี้
21-21283-16.wav	ออกมาขับรับส่งประชาชนที่ตั้งใจเดินทาง
21-21283-44.wav	ให้กับประชาชนที่เดินทางมาจากทั่วทุกสารทิศ
21-21286-3.wav	แถมกับมีอาหารแปรรูปพร้อมกับสร้างบรรยากาศน่าท่องเที่ยวด้วย
21-21286-46.wav	ที่เป็นภูมิปัญญาความอร่อยของชาวบ้านสาขาจังหวัดสมุทรปราการค่ะ
21-21287-15.wav	นางสาวเอก็แนะนำให้ไปเปิดบัญชี
21-21287-21.wav	กระทั่งสามีของนางสาวเอเสียชีวิตเมื่อเดือนตุลาคมปีที่แล้ว
21-21287-37.wav	ก็ไปติดต่อที่นางสาวเอบอกรับปาก
21-21288-21.wav	โซนจีนที่อำเภอปลวกแดงจังหวัดระยองนะคะ
21-21289-63.wav	รองผู้บังคับการตำรวจภูธรจังหวัดสงขลาครับ
21-21291-16.wav	เมื่อวานนี้ไปไหว้สารหลักเมืองที่จังหวัดนครศรีธรรมราชนะคะ
21-21291-22.wav	ก็คือตำรวจนายผู้ใหญ่ยังไปล้อมหน้าล้อมหนังเพียบแบบนี้นะคะ
21-21291-7.wav	ตำแหน่งที่ปรึกษาประจำสำนักนายกรัฐมนตรี
21-21292-256.wav	แล้วก็จังหวัดปราจีนบุรีกำลังตรวจสอบอย่างใกล้ชิดค่ะ
21-21292-341.wav	ซึ่งเอาเป็นว่าใครที่อยู่ในพื้นที่ที่คิดว่าน่าจะเป็นเส้นทางการเดินทาง
21-21292-367.wav	ก็เอาไปเช็คอีกอย่างเงี้ยอืมคือตอนเนี้ยปรากฏมันเดินทางไปหลายที่เหลือเกิน
21-21292-636.wav	คือเรื่องนี้ก็มีการเดินทางไปที่วัดบางกระดานะคะ
21-21292-648.wav	แล้วตัวของลูกชายเขาเองก็เดินทางมาจากจันทบุรีนะคะไปดูอาการ
21-21293-3.wav	ที่จังหวัดเชียงใหม่นะครับแล้วก็ได้ประกันไปในวงเงินหนึ่งแสนบาทครับ
21-21294-71.wav	กฎหมายผังเมืองมีทุกจังหวัดทั่วประเทศ
21-21296-4.wav	เสียงเพลงชาติไทยที่ดังกึกกล้องภายในโรงเรียนไทยรัฐวิทยา1จังหวัดลพบุรี
21-21297-2.wav	เกิดแรงระเบิดขึ้นในพื้นที่อำเภอหัวหินจังหวัดประจวบคีรีขันธ์
21-21297-30.wav	เพื่อที่จะเดินทางตามปกติค่ะ
21-21297-44.wav	เมืองหัวหินวันนี้ยังคงมีนักท่องเที่ยวเดินทางไปตากอากาศและพักผ่อนหย่อนใจ
21-21297-46.wav	ชาวบ้านที่นี่ยังต้อนรับนักท่องเที่ยวที่จะเดินทางไปชมเสน่ห์ของสถานที่ที่ขึ้นชื่อว่าเป็นเมืองตากอากาศของผู้ดีเก่า
21-21298-380.wav	คือในแอปพลิเคชันมันจะบอกแหละว่าเดินทางระยะเท่านี้
21-21298-569.wav	แต่ว่าระหว่างเดินทางกลับเนี่ยถูกรถหกล้อนะคะ
21-21298-716.wav	วันนี้เราจะยกคนความมันไปที่จังหวัดราชบุรี
21-21300-28.wav	จังหวัดเมียวดีที่พม่า
21-21300-34.wav	ก่อนที่จะรีบนำตัวส่งโรงพยาบาลพบพระจังหวัดตาก
21-21300-8.wav	มี31จังหวัดด้วยกันนับรวมแล้วตอนนี้
21-21301-3.wav	คือถูกคลื่นซัดกลางทะเลที่จังหวัดกระบี่
21-21302-16.wav	โอ้โหก็เวลานางชอบแกล้งอย่างนี้ให้ดูหน้าดูหลังนี่แหละ
21-21305-8.wav	กับการเดินทางไปแคมปิ้งการเดินทางไปคาราวาน
21-21313-38.wav	จะเดินทางมาติดต่อเพื่อขอรับศพถ้ามีความคืบหน้าเพิ่มเติมอื่นใด
21-21313-3.wav	ซึ่งเหตุการณ์ดังกล่าวทำให้มีผู้เสียชีวิตด้วยนะครับวันนี้ผมเดินทางมาติดตามความคืบหน้าที่สถาบันนิติเวชวิทยาโรงพยาบาลตำรวจครับ
21-21314-111.wav	เพราะว่ามันมีข่าวลือหนักมากว่าตอนนี้หัวใจของนางเนี่ย
21-21314-42.wav	ล่าสุดนางผุดโปรเจกต์รีสอร์ทสุดหรูบนเกาะล้าน
21-21316-26.wav	นางสาวแสงโสมนะฮะอายุ33ปีเป็นลูกสาวคนเล็ก
21-21317-106.wav	ช่วงบ่ายที่ผ่านมาหลังจากมีข่าวว่านายเหลิมเนี่ยนะ
21-21317-110.wav	เจอกับพี่ชายของนายเหลิมนะฮะซึ่งเขาก็มาเหมือนกัน
21-21317-111.wav	พี่ชายบอกว่าก็รู้ว่าน้องชายมามอบตัวก็เลยเดินทางมานะครับ
21-21317-117.wav	ก็ไปที่โรงพักเพราะรู้ว่านายเฉลิมไปมอบตัวก็เลยไปนะคะ
21-21317-12.wav	พอเมาพูดจาไม่เข้าหูกันผิดใจกันตัวนายเฉลิมเนี่ย
21-21317-136.wav	ไม่อยากจะให้นายเฉลิมเนี่ยหลุดคดีนี้นะ
21-21317-156.wav	เอาคุมได้แล้วนะฮะใช่ค่ะนายถนอมศักดิ์อ่ะนะคะ
21-21317-162.wav	พอได้ทั้งคู่แล้วตำรวจก็เลยบอกว่าแจ้งข้อหาทั้งนายเฉลิมและในเหลือ
21-21317-19.wav	หรือว่านายเฉลิมเนี่ยนะมีคนให้ข้อมูลมาว่า
21-21317-27.wav	ทีมข่าวของเราตรวจสอบเรื่องนี้ก็คือย้อนกลับไปที่บ้านของนายเฉลิมอีกรอบหนึ่ง
21-21317-42.wav	พอตื่นเช้ามามีคนมาบอกว่านายเฉลิมยิงคนตาย
21-21317-43.wav	เขาก็ตกใจมากพ่อของนายเฉลิมติดต่อมา
21-21317-48.wav	จากนั้นค่ะก็รู้มาว่านายเฉลิมก็ถูกตำรวจจับ
21-21317-78.wav	ก็ครบแล้วอ่ะชั่วโมงหนึ่งนะฮะแต่นายเฉลิมบอกว่าไม่ยอมครับ
21-21317-84.wav	ผู้จัดการวงดนตรีนะที่ชื่อนายเชิงชายค้าเจริญดีกับแดนเซอร์ของวงอีก1คนเสียชีวิตไป2ศพแล้วก็หลบหนีไป
21-21318-19.wav	ศักดีเป็นชาวบางใหญ่จังหวัดนนทบุรีมาถวายแก้บนหลวงพ่อสมหวังฮะ
21-21318-3.wav	ที่หลวงพ่อสมหวังที่จังหวัดนครปฐมนะครับ
21-21319-4.wav	แล้วก็นายศักดิ์ชายตันเจริญหรือว่ามดเล็กครับ
21-21321-35.wav	และประชาชนจำนวนมากที่เดินทางไปรับเสด็จในวันนั้น
21-21326-222.wav	สามารถมาได้เลยนะคะหรือว่าถ้าในวันนี้ใครที่ไม่สะดวกเดินทางค่ะ
21-21328-3.wav	เขาก็นำคณะสื่อมวลชนลงพื้นที่ไปที่จังหวัดภูเก็ตไปที่กะรน
21-21329-68.wav	พร้อมเสนอมาตรการรองรับการเดินทางก่อน
21-21329-90.wav	พร้อมขอให้ลดเวลาจัดงานของจังหวัดต่างในช่วงหลังเที่ยงคืน
21-21331-0.wav	ในอำเภอปรานบุรีจังหวัดประจวบคีรีขันธ์นะครับ
21-21333-0.wav	ส่วนที่จังหวัดเพชรบูรณ์ตอนนี้เนี่ยนะคะมีแก๊งมิจฉาชีพเล่นใหญ่ตั้งตัว
21-21333-20.wav	ก็พบกับนายเอนามสมมุตินะคะอันนี้เป็นน้องของผู้ที่ถูกอ้างว่าไปกู้เงินมา
21-21335-361.wav	คุณผู้ชมคะคืออันนี้นะคะสรุปว่าเจ้าที่ตำรวจมี2นาย
21-21335-437.wav	เพราะว่าส่วนหนึ่งเนี่ยผมเวลาไปประชุมจังหวัด
21-21335-630.wav	มีอีก3นายมารวมถึงสารวัตรด้วยนะคะ
21-21337-108.wav	สามารถมาได้ที่วัดนางสาวอำเภอกระทุ่มแบน
21-21337-109.wav	จังหวัดสมุทรสาครแห่งนี้ครับ
21-21337-20.wav	อยากทราบว่าวัดนางสาวชื่อเนี่ยแปลกมากเลยฮะ
21-21337-9.wav	อำเภอกระทุ่มแบนจังหวัดสมุทรสาครนั่นเองครับ
21-21338-3.wav	ซึ่งเจ้าหน้าที่กลุ่มงานเก็บกู้และตรวจพิสูจนวัตถุระเบิดกองกำกับการสืบสวนภูธรจังหวัดจันทบุรี
21-21339-44.wav	เดินทางโดยปลอดภัยแล้วก็เดือดร้อนน้อยที่สุดนะคะ
21-21340-11.wav	ที่โรงพยาบาลแห่งหนึ่งในจังหวัดสมุทรสาคร
21-21340-17.wav	โรงพยาบาลในจังหวัดปทุมธานีและเสียชีวิต
21-21340-31.wav	สาธารณสุขจังหวัดประสานญาติผู้เสียชีวิต
21-21340-39.wav	ท่านเป็นนายแพทย์สาธารณสุขจังหวัดสมุทรสาคร
21-21346-20.wav	ทีนี้พอนายโอเห็นตำรวจมาเคาะเรียกหน้าห้องนะคะ
21-21346-30.wav	เอาล่ะตำรวจก็เลยแจ้งข้อหาชิงทรัพย์นะคะไปตรวจสอบประวัติเนี่ยพบว่านายโอเนี่ยเคยโดนคดียาเสพติดมาก่อน
21-21347-0.wav	น้ำพริกแม่เฉลาที่จังหวัดกำแพงเพชรขายดิบขายดีก็บอกว่าสร้างรายได้หลักล้านต่อเดือน
21-21349-55.wav	ซึ่งนายสุเทพยังได้กล่าวถึงการที่พลเอกประยุทธ์
21-21349-67.wav	ส่วนที่พลเอกประยุทธ์ปฏิเสธร่วมเวทีดีเบตนายสุวิทย์บอกว่า
21-21350-334.wav	นายกลีเซียนลุงได้ชื่อว่าเป็นผู้นำได้ชื่อว่าเป็นผู้นำนะครับ
21-21350-59.wav	ท่านประธานครับเด็ก4เดือนฮะที่จังหวัดน่านบ้านผมเนี่ย
21-21350-707.wav	จังหวัดได้ตั้งศูนย์กักกันผู้ติดเชื้อเพื่อกระจายราย
21-21350-877.wav	นายพลังด่าดีไหมครับ
21-21351-21.wav	เป็นบ้านหลังหนึ่งนะครับตรวจสอบแล้วเป็นบ้านของนางทองเลื่อนปรุงแก้ว
21-21353-2.wav	ต้องใช้คำนี้เลยคำว่ารวบคาจังหวัดนครราชสีมาเลยคุณผู้ชมค่ะ
21-21355-19.wav	นายสมชัยอายุ53ปีตอนที่เจ้าหน้าที่เขาไปงมมานะ
21-21355-32.wav	ส่วนเมียของผู้ตายบ้างค่ะคือนางนิดดาแจ่มใส
21-21357-40.wav	เชียงใหม่ค่ะพี่เบิร์ตอำเภอเมืองจังหวัดเชียงใหม่ค่ะ
21-21358-650.wav	เขามีเรื่องเล่าสืบต่อกันมาค่ะว่าสมัยก่อนกองทัพพม่าได้เดินทางมาถึงตรงนี้ในช่วงรุ่งเช้า
21-21358-653.wav	ที่มาของชื่ออำเภอสว่างอารมณ์กองทัพพม่าเดินทางมาอำเภอสว่างอารมณ์
21-21358-669.wav	คุณผู้ชมครับกองทัพพม่าเขาเดินทางมาที่อำเภอสว่างอารมณ์
21-21358-777.wav	คุณวาสนาจากจังหวัดนครราชสีมาครับ
21-21359-33.wav	นายยิ่งบอกว่าปกติมาหาของป่าแถวนี้เป็นประจำอยู่แล้วก็เลยรู้เส้นทาง
21-21359-54.wav	อืมนี่หลังจากถูกตำรวจจับนายยันอืม
21-21359-60.wav	ได้คุยกับอดีตภรรยาของนายยอดที่ปัจจุบันก็คือ
21-21362-33.wav	หลายคนก็อาจจะวางแผนไปท่องเที่ยวนะคะ
21-21364-24.wav	เจ้าของบ้านคือนายจตุพรอายุ34ปี
21-21364-30.wav	ส่วนนายเบียร์เป็นเพื่อนที่มาขออาศัยอยู่บ้านนี้
21-21364-44.wav	ปรากฏว่านายเบียร์ที่บอกว่าปืนลั่น
21-21364-48.wav	แล้วก็ตำรวจสืบสวนสภ.บางบานคุมตัวนายเบียร์บัวขาวอายุ29ปี
21-21365-6.wav	สมัยเป็นเด็กนักเรียนเคยนั่งรถทัวร์จากบ้านจังหวัดร้อยเอ็ด
21-21365-7.wav	ไปดูวงระเบียบวาธศิลป์ถึงจังหวัดยโสธร
21-21366-1.wav	เขาบอกว่าเป็นเจ้าแรกของจังหวัดปราจีนบุรีอร่อยพูนชามลูกค้าแน่นร้านทุกวัน
21-21369-25.wav	ก็มีเจ้าหน้าที่เดินทางมารับที่บริเวณกุฏิเจ้าอาวาสค่ะ
