filename	text
102-102002-183.wav	การเดินทางมาร้านข้าวหมูแดงหมูกรอบหงษ์หยกก็ไม่ยากนะครับ
102-102002-4.wav	มันมีอยู่จริงอยู่ที่จังหวัดนครปฐมกับร้านร้านนี้ผมไปสืบเสาะหามาให้แล้ว
102-102002-23.wav	ตะลอนกินวันนี้นะครับบุกตะลุยมาถึงที่จังหวัดนครปฐมครับ
102-102003-5.wav	แล้วก็นายตาต้าชาวกะเหรี่ยงผู้ดูแลสำนักสงฆ์เต่าดำ
102-102003-21.wav	และชุดสืบสภ.ไทรโยคก็ได้เดินทางเข้าไปตรวจสอบพื้นที่เกิดเหตุเมื่อวานนี้
102-102003-24.wav	เดินทางไปสภ.ไทรโยคด้วยหลังจากที่นายตาต้าออกมายอมรับแล้วว่า
102-102003-23.wav	แล้วก็ควบคุมตัวนายตาต้าคนดูแลสำนักสงฆ์เต่าดำ
102-102003-37.wav	ทีนี้ส่องไฟไปเจอหมีขออยู่บนกิ่งต้นไทรหนึ่งในนั้นก็ส่งปืนให้กับนายตาต้า 